time,GBPUSD open,GBPUSD high,GBPUSD low,GBPUSD close,datetime
02.01.2021 00:00:00.000,1.3663,1.3663,1.3663,1.3663,2021-02-01 00:00:00+00:00
02.01.2021 01:00:00.000,1.3663,1.3663,1.3663,1.3663,2021-02-01 01:00:00+00:00
02.01.2021 02:00:00.000,1.3663,1.3663,1.3663,1.3663,2021-02-01 02:00:00+00:00
02.01.2021 03:00:00.000,1.3663,1.3663,1.3663,1.3663,2021-02-01 03:00:00+00:00
02.01.2021 04:00:00.000,1.3663,1.3663,1.3663,1.3663,2021-02-01 04:00:00+00:00
02.01.2021 05:00:00.000,1.3663,1.3663,1.3663,1.3663,2021-02-01 05:00:00+00:00
02.01.2021 06:00:00.000,1.3663,1.3663,1.3663,1.3663,2021-02-01 06:00:00+00:00
02.01.2021 07:00:00.000,1.3663,1.3663,1.3663,1.3663,2021-02-01 07:00:00+00:00
02.01.2021 08:00:00.000,1.3663,1.3663,1.3663,1.3663,2021-02-01 08:00:00+00:00
02.01.2021 09:00:00.000,1.3663,1.3663,1.3663,1.3663,2021-02-01 09:00:00+00:00
02.01.2021 10:00:00.000,1.3663,1.3663,1.3663,1.3663,2021-02-01 10:00:00+00:00
02.01.2021 11:00:00.000,1.3663,1.3663,1.3663,1.3663,2021-02-01 11:00:00+00:00
02.01.2021 12:00:00.000,1.3663,1.3663,1.3663,1.3663,2021-02-01 12:00:00+00:00
02.01.2021 13:00:00.000,1.3663,1.3663,1.3663,1.3663,2021-02-01 13:00:00+00:00
02.01.2021 14:00:00.000,1.3663,1.3663,1.3663,1.3663,2021-02-01 14:00:00+00:00
02.01.2021 15:00:00.000,1.3663,1.3663,1.3663,1.3663,2021-02-01 15:00:00+00:00
02.01.2021 16:00:00.000,1.3663,1.3663,1.3663,1.3663,2021-02-01 16:00:00+00:00
02.01.2021 17:00:00.000,1.3663,1.3663,1.3663,1.3663,2021-02-01 17:00:00+00:00
02.01.2021 18:00:00.000,1.3663,1.3663,1.3663,1.3663,2021-02-01 18:00:00+00:00
02.01.2021 19:00:00.000,1.3663,1.3663,1.3663,1.3663,2021-02-01 19:00:00+00:00
02.01.2021 20:00:00.000,1.3663,1.3663,1.3663,1.3663,2021-02-01 20:00:00+00:00
02.01.2021 21:00:00.000,1.3663,1.3663,1.3663,1.3663,2021-02-01 21:00:00+00:00
02.01.2021 22:00:00.000,1.3663,1.3663,1.3663,1.3663,2021-02-01 22:00:00+00:00
02.01.2021 23:00:00.000,1.3663,1.3663,1.3663,1.3663,2021-02-01 23:00:00+00:00
03.01.2021 00:00:00.000,1.3663,1.3663,1.3663,1.3663,2021-03-01 00:00:00+00:00
03.01.2021 01:00:00.000,1.3663,1.3663,1.3663,1.3663,2021-03-01 01:00:00+00:00
03.01.2021 02:00:00.000,1.3663,1.3663,1.3663,1.3663,2021-03-01 02:00:00+00:00
03.01.2021 03:00:00.000,1.3663,1.3663,1.3663,1.3663,2021-03-01 03:00:00+00:00
03.01.2021 04:00:00.000,1.3663,1.3663,1.3663,1.3663,2021-03-01 04:00:00+00:00
03.01.2021 05:00:00.000,1.3663,1.3663,1.3663,1.3663,2021-03-01 05:00:00+00:00
03.01.2021 06:00:00.000,1.3663,1.3663,1.3663,1.3663,2021-03-01 06:00:00+00:00
03.01.2021 07:00:00.000,1.3663,1.3663,1.3663,1.3663,2021-03-01 07:00:00+00:00
03.01.2021 08:00:00.000,1.3663,1.3663,1.3663,1.3663,2021-03-01 08:00:00+00:00
03.01.2021 09:00:00.000,1.3663,1.3663,1.3663,1.3663,2021-03-01 09:00:00+00:00
03.01.2021 10:00:00.000,1.3663,1.3663,1.3663,1.3663,2021-03-01 10:00:00+00:00
03.01.2021 11:00:00.000,1.3663,1.3663,1.3663,1.3663,2021-03-01 11:00:00+00:00
03.01.2021 12:00:00.000,1.3663,1.3663,1.3663,1.3663,2021-03-01 12:00:00+00:00
03.01.2021 13:00:00.000,1.3663,1.3663,1.3663,1.3663,2021-03-01 13:00:00+00:00
03.01.2021 14:00:00.000,1.3663,1.3663,1.3663,1.3663,2021-03-01 14:00:00+00:00
03.01.2021 15:00:00.000,1.3663,1.3663,1.3663,1.3663,2021-03-01 15:00:00+00:00
03.01.2021 16:00:00.000,1.3663,1.3663,1.3663,1.3663,2021-03-01 16:00:00+00:00
03.01.2021 17:00:00.000,1.3663,1.3663,1.3663,1.3663,2021-03-01 17:00:00+00:00
03.01.2021 18:00:00.000,1.3663,1.3663,1.3663,1.3663,2021-03-01 18:00:00+00:00
03.01.2021 19:00:00.000,1.3663,1.3663,1.3663,1.3663,2021-03-01 19:00:00+00:00
03.01.2021 20:00:00.000,1.3663,1.3663,1.3663,1.3663,2021-03-01 20:00:00+00:00
03.01.2021 21:00:00.000,1.3663,1.3663,1.3663,1.3663,2021-03-01 21:00:00+00:00
03.01.2021 22:00:00.000,1.36455,1.36627,1.36454,1.36589,2021-03-01 22:00:00+00:00
03.01.2021 23:00:00.000,1.36589,1.36831,1.3656,1.36803,2021-03-01 23:00:00+00:00
04.01.2021 00:00:00.000,1.36809,1.36832,1.36592,1.36727,2021-04-01 00:00:00+00:00
04.01.2021 01:00:00.000,1.36727,1.36896,1.36706,1.36822,2021-04-01 01:00:00+00:00
04.01.2021 02:00:00.000,1.3682,1.36946,1.36806,1.36922,2021-04-01 02:00:00+00:00
04.01.2021 03:00:00.000,1.36924,1.36961,1.36895,1.36954,2021-04-01 03:00:00+00:00
04.01.2021 04:00:00.000,1.36954,1.36981,1.36756,1.36806,2021-04-01 04:00:00+00:00
04.01.2021 05:00:00.000,1.36812,1.36859,1.36678,1.3683,2021-04-01 05:00:00+00:00
04.01.2021 06:00:00.000,1.3683,1.36865,1.36733,1.3685,2021-04-01 06:00:00+00:00
04.01.2021 07:00:00.000,1.36849,1.37029,1.36792,1.36871,2021-04-01 07:00:00+00:00
04.01.2021 08:00:00.000,1.36873,1.36956,1.36715,1.36905,2021-04-01 08:00:00+00:00
04.01.2021 09:00:00.000,1.36903,1.36966,1.36642,1.36726,2021-04-01 09:00:00+00:00
04.01.2021 10:00:00.000,1.36724,1.36963,1.36705,1.36923,2021-04-01 10:00:00+00:00
04.01.2021 11:00:00.000,1.36923,1.37039,1.36645,1.36697,2021-04-01 11:00:00+00:00
04.01.2021 12:00:00.000,1.36696,1.36702,1.36454,1.36537,2021-04-01 12:00:00+00:00
04.01.2021 13:00:00.000,1.36539,1.36565,1.36134,1.36257,2021-04-01 13:00:00+00:00
04.01.2021 14:00:00.000,1.36256,1.36317,1.36018,1.36075,2021-04-01 14:00:00+00:00
04.01.2021 15:00:00.000,1.36076,1.36078,1.35612,1.35778,2021-04-01 15:00:00+00:00
04.01.2021 16:00:00.000,1.35774,1.35955,1.35492,1.35499,2021-04-01 16:00:00+00:00
04.01.2021 17:00:00.000,1.35499,1.35711,1.35412,1.35659,2021-04-01 17:00:00+00:00
04.01.2021 18:00:00.000,1.35657,1.35687,1.35513,1.35627,2021-04-01 18:00:00+00:00
04.01.2021 19:00:00.000,1.35629,1.35675,1.35516,1.3566,2021-04-01 19:00:00+00:00
04.01.2021 20:00:00.000,1.3566,1.35678,1.35511,1.35677,2021-04-01 20:00:00+00:00
04.01.2021 21:00:00.000,1.35676,1.35786,1.3554,1.35664,2021-04-01 21:00:00+00:00
04.01.2021 22:00:00.000,1.35663,1.35764,1.35663,1.35738,2021-04-01 22:00:00+00:00
04.01.2021 23:00:00.000,1.35738,1.35782,1.35629,1.35705,2021-04-01 23:00:00+00:00
05.01.2021 00:00:00.000,1.35708,1.3577,1.35612,1.35707,2021-05-01 00:00:00+00:00
05.01.2021 01:00:00.000,1.35704,1.35782,1.35675,1.35695,2021-05-01 01:00:00+00:00
05.01.2021 02:00:00.000,1.35695,1.35886,1.35671,1.35854,2021-05-01 02:00:00+00:00
05.01.2021 03:00:00.000,1.3586,1.35956,1.35782,1.35851,2021-05-01 03:00:00+00:00
05.01.2021 04:00:00.000,1.35852,1.35895,1.35802,1.35866,2021-05-01 04:00:00+00:00
05.01.2021 05:00:00.000,1.35865,1.36024,1.35865,1.35969,2021-05-01 05:00:00+00:00
05.01.2021 06:00:00.000,1.35973,1.3612,1.35897,1.36059,2021-05-01 06:00:00+00:00
05.01.2021 07:00:00.000,1.36066,1.36087,1.35603,1.35689,2021-05-01 07:00:00+00:00
05.01.2021 08:00:00.000,1.35689,1.35937,1.3554,1.35594,2021-05-01 08:00:00+00:00
05.01.2021 09:00:00.000,1.35594,1.35892,1.3556,1.35725,2021-05-01 09:00:00+00:00
05.01.2021 10:00:00.000,1.35723,1.35937,1.35702,1.35851,2021-05-01 10:00:00+00:00
05.01.2021 11:00:00.000,1.35853,1.36073,1.35823,1.35901,2021-05-01 11:00:00+00:00
05.01.2021 12:00:00.000,1.35901,1.35929,1.35689,1.3584,2021-05-01 12:00:00+00:00
05.01.2021 13:00:00.000,1.35834,1.35931,1.3559,1.35668,2021-05-01 13:00:00+00:00
05.01.2021 14:00:00.000,1.35669,1.36016,1.35632,1.35991,2021-05-01 14:00:00+00:00
05.01.2021 15:00:00.000,1.35988,1.36038,1.3572,1.3593,2021-05-01 15:00:00+00:00
05.01.2021 16:00:00.000,1.3593,1.36237,1.35926,1.36175,2021-05-01 16:00:00+00:00
05.01.2021 17:00:00.000,1.36176,1.36417,1.36176,1.36325,2021-05-01 17:00:00+00:00
05.01.2021 18:00:00.000,1.36328,1.36336,1.36133,1.36274,2021-05-01 18:00:00+00:00
05.01.2021 19:00:00.000,1.36276,1.36346,1.36225,1.3629,2021-05-01 19:00:00+00:00
05.01.2021 20:00:00.000,1.36287,1.36342,1.36226,1.36255,2021-05-01 20:00:00+00:00
05.01.2021 21:00:00.000,1.36254,1.36277,1.36188,1.36259,2021-05-01 21:00:00+00:00
05.01.2021 22:00:00.000,1.36256,1.36256,1.36176,1.36194,2021-05-01 22:00:00+00:00
05.01.2021 23:00:00.000,1.36194,1.36286,1.36172,1.36268,2021-05-01 23:00:00+00:00
06.01.2021 00:00:00.000,1.36269,1.36465,1.36239,1.36334,2021-06-01 00:00:00+00:00
06.01.2021 01:00:00.000,1.36336,1.36385,1.35989,1.3606,2021-06-01 01:00:00+00:00
06.01.2021 02:00:00.000,1.3606,1.36101,1.35913,1.35949,2021-06-01 02:00:00+00:00
06.01.2021 03:00:00.000,1.35949,1.36106,1.35925,1.36005,2021-06-01 03:00:00+00:00
06.01.2021 04:00:00.000,1.36006,1.36201,1.35994,1.36088,2021-06-01 04:00:00+00:00
06.01.2021 05:00:00.000,1.36088,1.36204,1.36069,1.36153,2021-06-01 05:00:00+00:00
06.01.2021 06:00:00.000,1.36156,1.36313,1.36091,1.36293,2021-06-01 06:00:00+00:00
06.01.2021 07:00:00.000,1.36292,1.36598,1.36278,1.36578,2021-06-01 07:00:00+00:00
06.01.2021 08:00:00.000,1.36578,1.36607,1.36201,1.36244,2021-06-01 08:00:00+00:00
06.01.2021 09:00:00.000,1.36243,1.36454,1.36185,1.36442,2021-06-01 09:00:00+00:00
06.01.2021 10:00:00.000,1.3644,1.36707,1.36434,1.36554,2021-06-01 10:00:00+00:00
06.01.2021 11:00:00.000,1.3655,1.36659,1.36479,1.36479,2021-06-01 11:00:00+00:00
06.01.2021 12:00:00.000,1.36479,1.36538,1.36033,1.36154,2021-06-01 12:00:00+00:00
06.01.2021 13:00:00.000,1.36156,1.3629,1.35646,1.35648,2021-06-01 13:00:00+00:00
06.01.2021 14:00:00.000,1.35645,1.35903,1.35384,1.35784,2021-06-01 14:00:00+00:00
06.01.2021 15:00:00.000,1.35783,1.35898,1.35476,1.35507,2021-06-01 15:00:00+00:00
06.01.2021 16:00:00.000,1.35507,1.35952,1.35402,1.35902,2021-06-01 16:00:00+00:00
06.01.2021 17:00:00.000,1.35902,1.36066,1.35882,1.36046,2021-06-01 17:00:00+00:00
06.01.2021 18:00:00.000,1.36047,1.36194,1.3602,1.36163,2021-06-01 18:00:00+00:00
06.01.2021 19:00:00.000,1.36164,1.36182,1.35957,1.35983,2021-06-01 19:00:00+00:00
06.01.2021 20:00:00.000,1.35986,1.3626,1.35976,1.36086,2021-06-01 20:00:00+00:00
06.01.2021 21:00:00.000,1.36086,1.36156,1.36049,1.36078,2021-06-01 21:00:00+00:00
06.01.2021 22:00:00.000,1.36065,1.36143,1.35998,1.36071,2021-06-01 22:00:00+00:00
06.01.2021 23:00:00.000,1.36092,1.36266,1.36043,1.36234,2021-06-01 23:00:00+00:00
07.01.2021 00:00:00.000,1.36234,1.3633,1.36152,1.36225,2021-07-01 00:00:00+00:00
07.01.2021 01:00:00.000,1.36226,1.36289,1.36167,1.36196,2021-07-01 01:00:00+00:00
07.01.2021 02:00:00.000,1.36194,1.36203,1.35722,1.35885,2021-07-01 02:00:00+00:00
07.01.2021 03:00:00.000,1.35884,1.36014,1.35861,1.36008,2021-07-01 03:00:00+00:00
07.01.2021 04:00:00.000,1.36008,1.36089,1.35962,1.35973,2021-07-01 04:00:00+00:00
07.01.2021 05:00:00.000,1.35973,1.35985,1.3583,1.3584,2021-07-01 05:00:00+00:00
07.01.2021 06:00:00.000,1.35841,1.35934,1.35768,1.35898,2021-07-01 06:00:00+00:00
07.01.2021 07:00:00.000,1.35897,1.35996,1.35642,1.35805,2021-07-01 07:00:00+00:00
07.01.2021 08:00:00.000,1.35802,1.36266,1.35694,1.36076,2021-07-01 08:00:00+00:00
07.01.2021 09:00:00.000,1.36079,1.36163,1.35897,1.3594,2021-07-01 09:00:00+00:00
07.01.2021 10:00:00.000,1.35941,1.36071,1.35622,1.35686,2021-07-01 10:00:00+00:00
07.01.2021 11:00:00.000,1.35685,1.35918,1.35643,1.35677,2021-07-01 11:00:00+00:00
07.01.2021 12:00:00.000,1.35677,1.36094,1.35567,1.36039,2021-07-01 12:00:00+00:00
07.01.2021 13:00:00.000,1.36041,1.36129,1.35833,1.35879,2021-07-01 13:00:00+00:00
07.01.2021 14:00:00.000,1.35878,1.36032,1.35627,1.35643,2021-07-01 14:00:00+00:00
07.01.2021 15:00:00.000,1.3564,1.35737,1.35364,1.35492,2021-07-01 15:00:00+00:00
07.01.2021 16:00:00.000,1.35487,1.35689,1.35428,1.35486,2021-07-01 16:00:00+00:00
07.01.2021 17:00:00.000,1.35487,1.35584,1.35325,1.35482,2021-07-01 17:00:00+00:00
07.01.2021 18:00:00.000,1.3548,1.35718,1.3548,1.35717,2021-07-01 18:00:00+00:00
07.01.2021 19:00:00.000,1.35714,1.35776,1.35621,1.35703,2021-07-01 19:00:00+00:00
07.01.2021 20:00:00.000,1.35704,1.35729,1.35566,1.35662,2021-07-01 20:00:00+00:00
07.01.2021 21:00:00.000,1.35661,1.35702,1.35599,1.35611,2021-07-01 21:00:00+00:00
07.01.2021 22:00:00.000,1.35625,1.35668,1.35588,1.35602,2021-07-01 22:00:00+00:00
07.01.2021 23:00:00.000,1.35614,1.35698,1.35588,1.35684,2021-07-01 23:00:00+00:00
08.01.2021 00:00:00.000,1.35683,1.3572,1.35578,1.356,2021-08-01 00:00:00+00:00
08.01.2021 01:00:00.000,1.35602,1.35612,1.35378,1.35527,2021-08-01 01:00:00+00:00
08.01.2021 02:00:00.000,1.3553,1.35638,1.35464,1.35636,2021-08-01 02:00:00+00:00
08.01.2021 03:00:00.000,1.35638,1.35693,1.35595,1.35625,2021-08-01 03:00:00+00:00
08.01.2021 04:00:00.000,1.35625,1.35625,1.35557,1.35594,2021-08-01 04:00:00+00:00
08.01.2021 05:00:00.000,1.35595,1.35704,1.35591,1.356,2021-08-01 05:00:00+00:00
08.01.2021 06:00:00.000,1.35599,1.35761,1.35586,1.3573,2021-08-01 06:00:00+00:00
08.01.2021 07:00:00.000,1.3573,1.35881,1.35702,1.35774,2021-08-01 07:00:00+00:00
08.01.2021 08:00:00.000,1.35775,1.35854,1.35573,1.35803,2021-08-01 08:00:00+00:00
08.01.2021 09:00:00.000,1.35807,1.3602,1.35722,1.36003,2021-08-01 09:00:00+00:00
08.01.2021 10:00:00.000,1.36002,1.3605,1.35804,1.35834,2021-08-01 10:00:00+00:00
08.01.2021 11:00:00.000,1.35832,1.36008,1.35809,1.35927,2021-08-01 11:00:00+00:00
08.01.2021 12:00:00.000,1.35927,1.36072,1.35849,1.36005,2021-08-01 12:00:00+00:00
08.01.2021 13:00:00.000,1.36008,1.36259,1.35743,1.36193,2021-08-01 13:00:00+00:00
08.01.2021 14:00:00.000,1.36193,1.36356,1.358,1.35841,2021-08-01 14:00:00+00:00
08.01.2021 15:00:00.000,1.35839,1.35934,1.35475,1.359,2021-08-01 15:00:00+00:00
08.01.2021 16:00:00.000,1.359,1.35992,1.35648,1.35822,2021-08-01 16:00:00+00:00
08.01.2021 17:00:00.000,1.35822,1.35866,1.35712,1.35791,2021-08-01 17:00:00+00:00
08.01.2021 18:00:00.000,1.3579,1.3579,1.35428,1.35532,2021-08-01 18:00:00+00:00
08.01.2021 19:00:00.000,1.3553,1.35708,1.35527,1.3563,2021-08-01 19:00:00+00:00
08.01.2021 20:00:00.000,1.3563,1.35693,1.35593,1.35622,2021-08-01 20:00:00+00:00
08.01.2021 21:00:00.000,1.35621,1.35649,1.35521,1.35621,2021-08-01 21:00:00+00:00
08.01.2021 22:00:00.000,1.35621,1.35621,1.35621,1.35621,2021-08-01 22:00:00+00:00
08.01.2021 23:00:00.000,1.35621,1.35621,1.35621,1.35621,2021-08-01 23:00:00+00:00
09.01.2021 00:00:00.000,1.35621,1.35621,1.35621,1.35621,2021-09-01 00:00:00+00:00
09.01.2021 01:00:00.000,1.35621,1.35621,1.35621,1.35621,2021-09-01 01:00:00+00:00
09.01.2021 02:00:00.000,1.35621,1.35621,1.35621,1.35621,2021-09-01 02:00:00+00:00
09.01.2021 03:00:00.000,1.35621,1.35621,1.35621,1.35621,2021-09-01 03:00:00+00:00
09.01.2021 04:00:00.000,1.35621,1.35621,1.35621,1.35621,2021-09-01 04:00:00+00:00
09.01.2021 05:00:00.000,1.35621,1.35621,1.35621,1.35621,2021-09-01 05:00:00+00:00
09.01.2021 06:00:00.000,1.35621,1.35621,1.35621,1.35621,2021-09-01 06:00:00+00:00
09.01.2021 07:00:00.000,1.35621,1.35621,1.35621,1.35621,2021-09-01 07:00:00+00:00
09.01.2021 08:00:00.000,1.35621,1.35621,1.35621,1.35621,2021-09-01 08:00:00+00:00
09.01.2021 09:00:00.000,1.35621,1.35621,1.35621,1.35621,2021-09-01 09:00:00+00:00
09.01.2021 10:00:00.000,1.35621,1.35621,1.35621,1.35621,2021-09-01 10:00:00+00:00
09.01.2021 11:00:00.000,1.35621,1.35621,1.35621,1.35621,2021-09-01 11:00:00+00:00
09.01.2021 12:00:00.000,1.35621,1.35621,1.35621,1.35621,2021-09-01 12:00:00+00:00
09.01.2021 13:00:00.000,1.35621,1.35621,1.35621,1.35621,2021-09-01 13:00:00+00:00
09.01.2021 14:00:00.000,1.35621,1.35621,1.35621,1.35621,2021-09-01 14:00:00+00:00
09.01.2021 15:00:00.000,1.35621,1.35621,1.35621,1.35621,2021-09-01 15:00:00+00:00
09.01.2021 16:00:00.000,1.35621,1.35621,1.35621,1.35621,2021-09-01 16:00:00+00:00
09.01.2021 17:00:00.000,1.35621,1.35621,1.35621,1.35621,2021-09-01 17:00:00+00:00
09.01.2021 18:00:00.000,1.35621,1.35621,1.35621,1.35621,2021-09-01 18:00:00+00:00
09.01.2021 19:00:00.000,1.35621,1.35621,1.35621,1.35621,2021-09-01 19:00:00+00:00
09.01.2021 20:00:00.000,1.35621,1.35621,1.35621,1.35621,2021-09-01 20:00:00+00:00
09.01.2021 21:00:00.000,1.35621,1.35621,1.35621,1.35621,2021-09-01 21:00:00+00:00
09.01.2021 22:00:00.000,1.35621,1.35621,1.35621,1.35621,2021-09-01 22:00:00+00:00
09.01.2021 23:00:00.000,1.35621,1.35621,1.35621,1.35621,2021-09-01 23:00:00+00:00
10.01.2021 00:00:00.000,1.35621,1.35621,1.35621,1.35621,2021-10-01 00:00:00+00:00
10.01.2021 01:00:00.000,1.35621,1.35621,1.35621,1.35621,2021-10-01 01:00:00+00:00
10.01.2021 02:00:00.000,1.35621,1.35621,1.35621,1.35621,2021-10-01 02:00:00+00:00
10.01.2021 03:00:00.000,1.35621,1.35621,1.35621,1.35621,2021-10-01 03:00:00+00:00
10.01.2021 04:00:00.000,1.35621,1.35621,1.35621,1.35621,2021-10-01 04:00:00+00:00
10.01.2021 05:00:00.000,1.35621,1.35621,1.35621,1.35621,2021-10-01 05:00:00+00:00
10.01.2021 06:00:00.000,1.35621,1.35621,1.35621,1.35621,2021-10-01 06:00:00+00:00
10.01.2021 07:00:00.000,1.35621,1.35621,1.35621,1.35621,2021-10-01 07:00:00+00:00
10.01.2021 08:00:00.000,1.35621,1.35621,1.35621,1.35621,2021-10-01 08:00:00+00:00
10.01.2021 09:00:00.000,1.35621,1.35621,1.35621,1.35621,2021-10-01 09:00:00+00:00
10.01.2021 10:00:00.000,1.35621,1.35621,1.35621,1.35621,2021-10-01 10:00:00+00:00
10.01.2021 11:00:00.000,1.35621,1.35621,1.35621,1.35621,2021-10-01 11:00:00+00:00
10.01.2021 12:00:00.000,1.35621,1.35621,1.35621,1.35621,2021-10-01 12:00:00+00:00
10.01.2021 13:00:00.000,1.35621,1.35621,1.35621,1.35621,2021-10-01 13:00:00+00:00
10.01.2021 14:00:00.000,1.35621,1.35621,1.35621,1.35621,2021-10-01 14:00:00+00:00
10.01.2021 15:00:00.000,1.35621,1.35621,1.35621,1.35621,2021-10-01 15:00:00+00:00
10.01.2021 16:00:00.000,1.35621,1.35621,1.35621,1.35621,2021-10-01 16:00:00+00:00
10.01.2021 17:00:00.000,1.35621,1.35621,1.35621,1.35621,2021-10-01 17:00:00+00:00
10.01.2021 18:00:00.000,1.35621,1.35621,1.35621,1.35621,2021-10-01 18:00:00+00:00
10.01.2021 19:00:00.000,1.35621,1.35621,1.35621,1.35621,2021-10-01 19:00:00+00:00
10.01.2021 20:00:00.000,1.35621,1.35621,1.35621,1.35621,2021-10-01 20:00:00+00:00
10.01.2021 21:00:00.000,1.35621,1.35621,1.35621,1.35621,2021-10-01 21:00:00+00:00
10.01.2021 22:00:00.000,1.35588,1.35697,1.35505,1.3558,2021-10-01 22:00:00+00:00
10.01.2021 23:00:00.000,1.35582,1.35654,1.35095,1.35182,2021-10-01 23:00:00+00:00
11.01.2021 00:00:00.000,1.35181,1.35289,1.35154,1.35263,2021-11-01 00:00:00+00:00
11.01.2021 01:00:00.000,1.35261,1.35272,1.35051,1.35087,2021-11-01 01:00:00+00:00
11.01.2021 02:00:00.000,1.35087,1.35157,1.34956,1.35156,2021-11-01 02:00:00+00:00
11.01.2021 03:00:00.000,1.35157,1.35158,1.35005,1.35047,2021-11-01 03:00:00+00:00
11.01.2021 04:00:00.000,1.35049,1.35085,1.34914,1.34984,2021-11-01 04:00:00+00:00
11.01.2021 05:00:00.000,1.34982,1.35017,1.34924,1.35004,2021-11-01 05:00:00+00:00
11.01.2021 06:00:00.000,1.35006,1.35132,1.3493,1.3512,2021-11-01 06:00:00+00:00
11.01.2021 07:00:00.000,1.35115,1.35129,1.34824,1.34828,2021-11-01 07:00:00+00:00
11.01.2021 08:00:00.000,1.34827,1.35092,1.34822,1.35089,2021-11-01 08:00:00+00:00
11.01.2021 09:00:00.000,1.3509,1.35155,1.34915,1.34923,2021-11-01 09:00:00+00:00
11.01.2021 10:00:00.000,1.34923,1.35022,1.34852,1.34962,2021-11-01 10:00:00+00:00
11.01.2021 11:00:00.000,1.34961,1.35023,1.34835,1.34853,2021-11-01 11:00:00+00:00
11.01.2021 12:00:00.000,1.34854,1.3488,1.3464,1.34807,2021-11-01 12:00:00+00:00
11.01.2021 13:00:00.000,1.34806,1.34826,1.34579,1.34645,2021-11-01 13:00:00+00:00
11.01.2021 14:00:00.000,1.34647,1.34851,1.34503,1.34557,2021-11-01 14:00:00+00:00
11.01.2021 15:00:00.000,1.34555,1.34954,1.34518,1.34859,2021-11-01 15:00:00+00:00
11.01.2021 16:00:00.000,1.34858,1.35258,1.34783,1.35205,2021-11-01 16:00:00+00:00
11.01.2021 17:00:00.000,1.35204,1.35303,1.35185,1.35253,2021-11-01 17:00:00+00:00
11.01.2021 18:00:00.000,1.3525,1.35293,1.35211,1.35242,2021-11-01 18:00:00+00:00
11.01.2021 19:00:00.000,1.35243,1.35347,1.35232,1.35254,2021-11-01 19:00:00+00:00
11.01.2021 20:00:00.000,1.35252,1.35265,1.35162,1.35198,2021-11-01 20:00:00+00:00
11.01.2021 21:00:00.000,1.35198,1.35217,1.35086,1.35102,2021-11-01 21:00:00+00:00
11.01.2021 22:00:00.000,1.35094,1.35177,1.35067,1.35067,2021-11-01 22:00:00+00:00
11.01.2021 23:00:00.000,1.35068,1.35276,1.35067,1.35225,2021-11-01 23:00:00+00:00
12.01.2021 00:00:00.000,1.35225,1.35262,1.351,1.35193,2021-12-01 00:00:00+00:00
12.01.2021 01:00:00.000,1.35197,1.35301,1.3504,1.35228,2021-12-01 01:00:00+00:00
12.01.2021 02:00:00.000,1.35227,1.35279,1.35157,1.35231,2021-12-01 02:00:00+00:00
12.01.2021 03:00:00.000,1.35235,1.35268,1.35199,1.35212,2021-12-01 03:00:00+00:00
12.01.2021 04:00:00.000,1.35211,1.35261,1.35154,1.3524,2021-12-01 04:00:00+00:00
12.01.2021 05:00:00.000,1.3524,1.35447,1.35198,1.35431,2021-12-01 05:00:00+00:00
12.01.2021 06:00:00.000,1.3543,1.35581,1.35376,1.3554,2021-12-01 06:00:00+00:00
12.01.2021 07:00:00.000,1.35539,1.35677,1.35459,1.35528,2021-12-01 07:00:00+00:00
12.01.2021 08:00:00.000,1.35528,1.35575,1.35383,1.35539,2021-12-01 08:00:00+00:00
12.01.2021 09:00:00.000,1.35537,1.36063,1.35423,1.36022,2021-12-01 09:00:00+00:00
12.01.2021 10:00:00.000,1.36027,1.3605,1.35754,1.35758,2021-12-01 10:00:00+00:00
12.01.2021 11:00:00.000,1.35756,1.36038,1.35756,1.35865,2021-12-01 11:00:00+00:00
12.01.2021 12:00:00.000,1.3587,1.36021,1.35813,1.35952,2021-12-01 12:00:00+00:00
12.01.2021 13:00:00.000,1.35954,1.36017,1.35801,1.35867,2021-12-01 13:00:00+00:00
12.01.2021 14:00:00.000,1.35866,1.36055,1.35804,1.36,2021-12-01 14:00:00+00:00
12.01.2021 15:00:00.000,1.35998,1.36315,1.35897,1.36172,2021-12-01 15:00:00+00:00
12.01.2021 16:00:00.000,1.36172,1.36356,1.36153,1.36352,2021-12-01 16:00:00+00:00
12.01.2021 17:00:00.000,1.3635,1.36369,1.36199,1.36241,2021-12-01 17:00:00+00:00
12.01.2021 18:00:00.000,1.36244,1.36479,1.36209,1.36405,2021-12-01 18:00:00+00:00
12.01.2021 19:00:00.000,1.36408,1.36673,1.36395,1.36635,2021-12-01 19:00:00+00:00
12.01.2021 20:00:00.000,1.36634,1.36682,1.36573,1.36651,2021-12-01 20:00:00+00:00
12.01.2021 21:00:00.000,1.36651,1.367,1.3662,1.36628,2021-12-01 21:00:00+00:00
12.01.2021 22:00:00.000,1.36625,1.36646,1.36577,1.36622,2021-12-01 22:00:00+00:00
12.01.2021 23:00:00.000,1.36621,1.36685,1.3661,1.36664,2021-12-01 23:00:00+00:00
13.01.2021 00:00:00.000,1.36665,1.36796,1.36664,1.36693,2021-01-13 00:00:00+00:00
13.01.2021 01:00:00.000,1.36692,1.36827,1.36664,1.36787,2021-01-13 01:00:00+00:00
13.01.2021 02:00:00.000,1.36785,1.36847,1.36769,1.36803,2021-01-13 02:00:00+00:00
13.01.2021 03:00:00.000,1.36801,1.36926,1.36799,1.36875,2021-01-13 03:00:00+00:00
13.01.2021 04:00:00.000,1.36876,1.36883,1.36788,1.3679,2021-01-13 04:00:00+00:00
13.01.2021 05:00:00.000,1.36791,1.36828,1.36746,1.36769,2021-01-13 05:00:00+00:00
13.01.2021 06:00:00.000,1.3677,1.36801,1.36703,1.36746,2021-01-13 06:00:00+00:00
13.01.2021 07:00:00.000,1.36747,1.36998,1.36735,1.36804,2021-01-13 07:00:00+00:00
13.01.2021 08:00:00.000,1.36807,1.3688,1.3662,1.36853,2021-01-13 08:00:00+00:00
13.01.2021 09:00:00.000,1.36851,1.37009,1.36771,1.36891,2021-01-13 09:00:00+00:00
13.01.2021 10:00:00.000,1.36888,1.36931,1.36651,1.36704,2021-01-13 10:00:00+00:00
13.01.2021 11:00:00.000,1.36707,1.36721,1.3653,1.36693,2021-01-13 11:00:00+00:00
13.01.2021 12:00:00.000,1.36694,1.36839,1.36647,1.36743,2021-01-13 12:00:00+00:00
13.01.2021 13:00:00.000,1.36742,1.36932,1.36689,1.36813,2021-01-13 13:00:00+00:00
13.01.2021 14:00:00.000,1.36813,1.36821,1.36442,1.3647,2021-01-13 14:00:00+00:00
13.01.2021 15:00:00.000,1.3647,1.36674,1.36329,1.36362,2021-01-13 15:00:00+00:00
13.01.2021 16:00:00.000,1.36362,1.36425,1.36209,1.36291,2021-01-13 16:00:00+00:00
13.01.2021 17:00:00.000,1.36292,1.36408,1.36113,1.36392,2021-01-13 17:00:00+00:00
13.01.2021 18:00:00.000,1.36394,1.36521,1.36307,1.36317,2021-01-13 18:00:00+00:00
13.01.2021 19:00:00.000,1.36316,1.36414,1.36283,1.36299,2021-01-13 19:00:00+00:00
13.01.2021 20:00:00.000,1.36297,1.36355,1.36256,1.36299,2021-01-13 20:00:00+00:00
13.01.2021 21:00:00.000,1.36297,1.36401,1.36289,1.36336,2021-01-13 21:00:00+00:00
13.01.2021 22:00:00.000,1.36352,1.36427,1.36329,1.36385,2021-01-13 22:00:00+00:00
13.01.2021 23:00:00.000,1.36384,1.36501,1.36336,1.36471,2021-01-13 23:00:00+00:00
14.01.2021 00:00:00.000,1.36471,1.36533,1.36419,1.36496,2021-01-14 00:00:00+00:00
14.01.2021 01:00:00.000,1.36496,1.3655,1.36482,1.36499,2021-01-14 01:00:00+00:00
14.01.2021 02:00:00.000,1.36498,1.36511,1.3616,1.36408,2021-01-14 02:00:00+00:00
14.01.2021 03:00:00.000,1.36407,1.36417,1.36279,1.36362,2021-01-14 03:00:00+00:00
14.01.2021 04:00:00.000,1.36365,1.36424,1.3634,1.36403,2021-01-14 04:00:00+00:00
14.01.2021 05:00:00.000,1.36403,1.3641,1.36275,1.36386,2021-01-14 05:00:00+00:00
14.01.2021 06:00:00.000,1.36388,1.36408,1.3629,1.36354,2021-01-14 06:00:00+00:00
14.01.2021 07:00:00.000,1.36353,1.36579,1.36277,1.36559,2021-01-14 07:00:00+00:00
14.01.2021 08:00:00.000,1.3656,1.36801,1.36515,1.3659,2021-01-14 08:00:00+00:00
14.01.2021 09:00:00.000,1.3659,1.36605,1.3633,1.36519,2021-01-14 09:00:00+00:00
14.01.2021 10:00:00.000,1.36518,1.36622,1.36462,1.36518,2021-01-14 10:00:00+00:00
14.01.2021 11:00:00.000,1.36519,1.36571,1.364,1.36479,2021-01-14 11:00:00+00:00
14.01.2021 12:00:00.000,1.36479,1.36577,1.3634,1.36354,2021-01-14 12:00:00+00:00
14.01.2021 13:00:00.000,1.36356,1.36379,1.36204,1.36268,2021-01-14 13:00:00+00:00
14.01.2021 14:00:00.000,1.36268,1.36581,1.36232,1.36505,2021-01-14 14:00:00+00:00
14.01.2021 15:00:00.000,1.36506,1.36837,1.36388,1.368,2021-01-14 15:00:00+00:00
14.01.2021 16:00:00.000,1.36801,1.36938,1.36676,1.36891,2021-01-14 16:00:00+00:00
14.01.2021 17:00:00.000,1.36893,1.37107,1.36754,1.36888,2021-01-14 17:00:00+00:00
14.01.2021 18:00:00.000,1.36889,1.36936,1.36692,1.36732,2021-01-14 18:00:00+00:00
14.01.2021 19:00:00.000,1.36731,1.36823,1.36714,1.36812,2021-01-14 19:00:00+00:00
14.01.2021 20:00:00.000,1.36813,1.37014,1.36804,1.36923,2021-01-14 20:00:00+00:00
14.01.2021 21:00:00.000,1.36924,1.36965,1.36831,1.36861,2021-01-14 21:00:00+00:00
14.01.2021 22:00:00.000,1.36856,1.36923,1.3684,1.36869,2021-01-14 22:00:00+00:00
14.01.2021 23:00:00.000,1.36875,1.36888,1.36807,1.36822,2021-01-14 23:00:00+00:00
15.01.2021 00:00:00.000,1.3682,1.36977,1.36811,1.36862,2021-01-15 00:00:00+00:00
15.01.2021 01:00:00.000,1.36863,1.36907,1.36811,1.36827,2021-01-15 01:00:00+00:00
15.01.2021 02:00:00.000,1.36828,1.36889,1.36743,1.36888,2021-01-15 02:00:00+00:00
15.01.2021 03:00:00.000,1.36888,1.36916,1.36809,1.36817,2021-01-15 03:00:00+00:00
15.01.2021 04:00:00.000,1.36816,1.3684,1.36755,1.36802,2021-01-15 04:00:00+00:00
15.01.2021 05:00:00.000,1.36801,1.36846,1.36666,1.3674,2021-01-15 05:00:00+00:00
15.01.2021 06:00:00.000,1.36738,1.36799,1.36575,1.36643,2021-01-15 06:00:00+00:00
15.01.2021 07:00:00.000,1.36645,1.36771,1.36601,1.36625,2021-01-15 07:00:00+00:00
15.01.2021 08:00:00.000,1.36625,1.36699,1.36452,1.36492,2021-01-15 08:00:00+00:00
15.01.2021 09:00:00.000,1.36493,1.36566,1.36372,1.36399,2021-01-15 09:00:00+00:00
15.01.2021 10:00:00.000,1.36399,1.36602,1.36379,1.36544,2021-01-15 10:00:00+00:00
15.01.2021 11:00:00.000,1.36542,1.3656,1.3637,1.36388,2021-01-15 11:00:00+00:00
15.01.2021 12:00:00.000,1.36386,1.36415,1.3613,1.36229,2021-01-15 12:00:00+00:00
15.01.2021 13:00:00.000,1.36228,1.36349,1.36053,1.36053,2021-01-15 13:00:00+00:00
15.01.2021 14:00:00.000,1.36057,1.36151,1.3594,1.36,2021-01-15 14:00:00+00:00
15.01.2021 15:00:00.000,1.36,1.36008,1.35721,1.35837,2021-01-15 15:00:00+00:00
15.01.2021 16:00:00.000,1.35837,1.36055,1.35743,1.35969,2021-01-15 16:00:00+00:00
15.01.2021 17:00:00.000,1.35971,1.36064,1.35904,1.36053,2021-01-15 17:00:00+00:00
15.01.2021 18:00:00.000,1.36049,1.3605,1.35773,1.3587,2021-01-15 18:00:00+00:00
15.01.2021 19:00:00.000,1.35874,1.35915,1.35794,1.35794,2021-01-15 19:00:00+00:00
15.01.2021 20:00:00.000,1.35795,1.3589,1.35795,1.35831,2021-01-15 20:00:00+00:00
15.01.2021 21:00:00.000,1.35831,1.3589,1.35755,1.35769,2021-01-15 21:00:00+00:00
15.01.2021 22:00:00.000,1.35769,1.35769,1.35769,1.35769,2021-01-15 22:00:00+00:00
15.01.2021 23:00:00.000,1.35769,1.35769,1.35769,1.35769,2021-01-15 23:00:00+00:00
16.01.2021 00:00:00.000,1.35769,1.35769,1.35769,1.35769,2021-01-16 00:00:00+00:00
16.01.2021 01:00:00.000,1.35769,1.35769,1.35769,1.35769,2021-01-16 01:00:00+00:00
16.01.2021 02:00:00.000,1.35769,1.35769,1.35769,1.35769,2021-01-16 02:00:00+00:00
16.01.2021 03:00:00.000,1.35769,1.35769,1.35769,1.35769,2021-01-16 03:00:00+00:00
16.01.2021 04:00:00.000,1.35769,1.35769,1.35769,1.35769,2021-01-16 04:00:00+00:00
16.01.2021 05:00:00.000,1.35769,1.35769,1.35769,1.35769,2021-01-16 05:00:00+00:00
16.01.2021 06:00:00.000,1.35769,1.35769,1.35769,1.35769,2021-01-16 06:00:00+00:00
16.01.2021 07:00:00.000,1.35769,1.35769,1.35769,1.35769,2021-01-16 07:00:00+00:00
16.01.2021 08:00:00.000,1.35769,1.35769,1.35769,1.35769,2021-01-16 08:00:00+00:00
16.01.2021 09:00:00.000,1.35769,1.35769,1.35769,1.35769,2021-01-16 09:00:00+00:00
16.01.2021 10:00:00.000,1.35769,1.35769,1.35769,1.35769,2021-01-16 10:00:00+00:00
16.01.2021 11:00:00.000,1.35769,1.35769,1.35769,1.35769,2021-01-16 11:00:00+00:00
16.01.2021 12:00:00.000,1.35769,1.35769,1.35769,1.35769,2021-01-16 12:00:00+00:00
16.01.2021 13:00:00.000,1.35769,1.35769,1.35769,1.35769,2021-01-16 13:00:00+00:00
16.01.2021 14:00:00.000,1.35769,1.35769,1.35769,1.35769,2021-01-16 14:00:00+00:00
16.01.2021 15:00:00.000,1.35769,1.35769,1.35769,1.35769,2021-01-16 15:00:00+00:00
16.01.2021 16:00:00.000,1.35769,1.35769,1.35769,1.35769,2021-01-16 16:00:00+00:00
16.01.2021 17:00:00.000,1.35769,1.35769,1.35769,1.35769,2021-01-16 17:00:00+00:00
16.01.2021 18:00:00.000,1.35769,1.35769,1.35769,1.35769,2021-01-16 18:00:00+00:00
16.01.2021 19:00:00.000,1.35769,1.35769,1.35769,1.35769,2021-01-16 19:00:00+00:00
16.01.2021 20:00:00.000,1.35769,1.35769,1.35769,1.35769,2021-01-16 20:00:00+00:00
16.01.2021 21:00:00.000,1.35769,1.35769,1.35769,1.35769,2021-01-16 21:00:00+00:00
16.01.2021 22:00:00.000,1.35769,1.35769,1.35769,1.35769,2021-01-16 22:00:00+00:00
16.01.2021 23:00:00.000,1.35769,1.35769,1.35769,1.35769,2021-01-16 23:00:00+00:00
17.01.2021 00:00:00.000,1.35769,1.35769,1.35769,1.35769,2021-01-17 00:00:00+00:00
17.01.2021 01:00:00.000,1.35769,1.35769,1.35769,1.35769,2021-01-17 01:00:00+00:00
17.01.2021 02:00:00.000,1.35769,1.35769,1.35769,1.35769,2021-01-17 02:00:00+00:00
17.01.2021 03:00:00.000,1.35769,1.35769,1.35769,1.35769,2021-01-17 03:00:00+00:00
17.01.2021 04:00:00.000,1.35769,1.35769,1.35769,1.35769,2021-01-17 04:00:00+00:00
17.01.2021 05:00:00.000,1.35769,1.35769,1.35769,1.35769,2021-01-17 05:00:00+00:00
17.01.2021 06:00:00.000,1.35769,1.35769,1.35769,1.35769,2021-01-17 06:00:00+00:00
17.01.2021 07:00:00.000,1.35769,1.35769,1.35769,1.35769,2021-01-17 07:00:00+00:00
17.01.2021 08:00:00.000,1.35769,1.35769,1.35769,1.35769,2021-01-17 08:00:00+00:00
17.01.2021 09:00:00.000,1.35769,1.35769,1.35769,1.35769,2021-01-17 09:00:00+00:00
17.01.2021 10:00:00.000,1.35769,1.35769,1.35769,1.35769,2021-01-17 10:00:00+00:00
17.01.2021 11:00:00.000,1.35769,1.35769,1.35769,1.35769,2021-01-17 11:00:00+00:00
17.01.2021 12:00:00.000,1.35769,1.35769,1.35769,1.35769,2021-01-17 12:00:00+00:00
17.01.2021 13:00:00.000,1.35769,1.35769,1.35769,1.35769,2021-01-17 13:00:00+00:00
17.01.2021 14:00:00.000,1.35769,1.35769,1.35769,1.35769,2021-01-17 14:00:00+00:00
17.01.2021 15:00:00.000,1.35769,1.35769,1.35769,1.35769,2021-01-17 15:00:00+00:00
17.01.2021 16:00:00.000,1.35769,1.35769,1.35769,1.35769,2021-01-17 16:00:00+00:00
17.01.2021 17:00:00.000,1.35769,1.35769,1.35769,1.35769,2021-01-17 17:00:00+00:00
17.01.2021 18:00:00.000,1.35769,1.35769,1.35769,1.35769,2021-01-17 18:00:00+00:00
17.01.2021 19:00:00.000,1.35769,1.35769,1.35769,1.35769,2021-01-17 19:00:00+00:00
17.01.2021 20:00:00.000,1.35769,1.35769,1.35769,1.35769,2021-01-17 20:00:00+00:00
17.01.2021 21:00:00.000,1.35769,1.35769,1.35769,1.35769,2021-01-17 21:00:00+00:00
17.01.2021 22:00:00.000,1.35922,1.35996,1.35843,1.35848,2021-01-17 22:00:00+00:00
17.01.2021 23:00:00.000,1.35847,1.35983,1.35691,1.35702,2021-01-17 23:00:00+00:00
18.01.2021 00:00:00.000,1.35702,1.35858,1.35658,1.35787,2021-01-18 00:00:00+00:00
18.01.2021 01:00:00.000,1.35787,1.35875,1.35745,1.35852,2021-01-18 01:00:00+00:00
18.01.2021 02:00:00.000,1.35853,1.35894,1.3579,1.35868,2021-01-18 02:00:00+00:00
18.01.2021 03:00:00.000,1.35869,1.35871,1.35722,1.35758,2021-01-18 03:00:00+00:00
18.01.2021 04:00:00.000,1.35758,1.35761,1.35594,1.35634,2021-01-18 04:00:00+00:00
18.01.2021 05:00:00.000,1.35635,1.35717,1.35603,1.35716,2021-01-18 05:00:00+00:00
18.01.2021 06:00:00.000,1.35716,1.35732,1.35633,1.35666,2021-01-18 06:00:00+00:00
18.01.2021 07:00:00.000,1.35665,1.35698,1.35513,1.35527,2021-01-18 07:00:00+00:00
18.01.2021 08:00:00.000,1.35527,1.35601,1.35237,1.35274,2021-01-18 08:00:00+00:00
18.01.2021 09:00:00.000,1.35275,1.35393,1.35193,1.35286,2021-01-18 09:00:00+00:00
18.01.2021 10:00:00.000,1.35287,1.35469,1.35254,1.35398,2021-01-18 10:00:00+00:00
18.01.2021 11:00:00.000,1.35397,1.35555,1.35343,1.35487,2021-01-18 11:00:00+00:00
18.01.2021 12:00:00.000,1.35487,1.35549,1.35308,1.35339,2021-01-18 12:00:00+00:00
18.01.2021 13:00:00.000,1.35338,1.35572,1.35297,1.35553,2021-01-18 13:00:00+00:00
18.01.2021 14:00:00.000,1.35553,1.35685,1.35445,1.35654,2021-01-18 14:00:00+00:00
18.01.2021 15:00:00.000,1.35656,1.3578,1.35619,1.35743,2021-01-18 15:00:00+00:00
18.01.2021 16:00:00.000,1.35744,1.35824,1.3569,1.35821,2021-01-18 16:00:00+00:00
18.01.2021 17:00:00.000,1.3582,1.35873,1.35728,1.35812,2021-01-18 17:00:00+00:00
18.01.2021 18:00:00.000,1.35814,1.35838,1.35782,1.35813,2021-01-18 18:00:00+00:00
18.01.2021 19:00:00.000,1.35816,1.35873,1.3581,1.35863,2021-01-18 19:00:00+00:00
18.01.2021 20:00:00.000,1.35864,1.35872,1.35818,1.35861,2021-01-18 20:00:00+00:00
18.01.2021 21:00:00.000,1.35861,1.35874,1.35849,1.35852,2021-01-18 21:00:00+00:00
18.01.2021 22:00:00.000,1.35853,1.35876,1.35743,1.35799,2021-01-18 22:00:00+00:00
18.01.2021 23:00:00.000,1.358,1.35834,1.35777,1.3582,2021-01-18 23:00:00+00:00
19.01.2021 00:00:00.000,1.35822,1.3599,1.35809,1.35928,2021-01-19 00:00:00+00:00
19.01.2021 01:00:00.000,1.3593,1.36102,1.35919,1.36028,2021-01-19 01:00:00+00:00
19.01.2021 02:00:00.000,1.36029,1.36144,1.35997,1.36018,2021-01-19 02:00:00+00:00
19.01.2021 03:00:00.000,1.36018,1.36071,1.3598,1.36054,2021-01-19 03:00:00+00:00
19.01.2021 04:00:00.000,1.36054,1.36064,1.36007,1.3605,2021-01-19 04:00:00+00:00
19.01.2021 05:00:00.000,1.36051,1.36101,1.36009,1.36083,2021-01-19 05:00:00+00:00
19.01.2021 06:00:00.000,1.36084,1.36093,1.36009,1.36067,2021-01-19 06:00:00+00:00
19.01.2021 07:00:00.000,1.36075,1.36084,1.3584,1.36031,2021-01-19 07:00:00+00:00
19.01.2021 08:00:00.000,1.36032,1.36113,1.35897,1.36028,2021-01-19 08:00:00+00:00
19.01.2021 09:00:00.000,1.36031,1.36125,1.35958,1.36071,2021-01-19 09:00:00+00:00
19.01.2021 10:00:00.000,1.36076,1.36267,1.36067,1.3616,2021-01-19 10:00:00+00:00
19.01.2021 11:00:00.000,1.3616,1.36247,1.36108,1.36136,2021-01-19 11:00:00+00:00
19.01.2021 12:00:00.000,1.36136,1.36204,1.36047,1.36087,2021-01-19 12:00:00+00:00
19.01.2021 13:00:00.000,1.36085,1.362,1.36039,1.36154,2021-01-19 13:00:00+00:00
19.01.2021 14:00:00.000,1.36156,1.36204,1.3606,1.36145,2021-01-19 14:00:00+00:00
19.01.2021 15:00:00.000,1.36146,1.36246,1.36043,1.36182,2021-01-19 15:00:00+00:00
19.01.2021 16:00:00.000,1.36184,1.36276,1.36095,1.36255,2021-01-19 16:00:00+00:00
19.01.2021 17:00:00.000,1.36255,1.36283,1.36161,1.36251,2021-01-19 17:00:00+00:00
19.01.2021 18:00:00.000,1.36253,1.36284,1.36192,1.36253,2021-01-19 18:00:00+00:00
19.01.2021 19:00:00.000,1.36253,1.36362,1.36211,1.36312,2021-01-19 19:00:00+00:00
19.01.2021 20:00:00.000,1.36312,1.36344,1.36267,1.36343,2021-01-19 20:00:00+00:00
19.01.2021 21:00:00.000,1.36344,1.36363,1.36289,1.36289,2021-01-19 21:00:00+00:00
19.01.2021 22:00:00.000,1.36289,1.36334,1.36252,1.3633,2021-01-19 22:00:00+00:00
19.01.2021 23:00:00.000,1.3633,1.36471,1.36305,1.36437,2021-01-19 23:00:00+00:00
20.01.2021 00:00:00.000,1.36436,1.36498,1.36362,1.36406,2021-01-20 00:00:00+00:00
20.01.2021 01:00:00.000,1.36407,1.36503,1.3634,1.3643,2021-01-20 01:00:00+00:00
20.01.2021 02:00:00.000,1.36429,1.36569,1.36429,1.3652,2021-01-20 02:00:00+00:00
20.01.2021 03:00:00.000,1.3652,1.3657,1.3647,1.36502,2021-01-20 03:00:00+00:00
20.01.2021 04:00:00.000,1.36504,1.36539,1.36466,1.36499,2021-01-20 04:00:00+00:00
20.01.2021 05:00:00.000,1.36501,1.36572,1.36499,1.36538,2021-01-20 05:00:00+00:00
20.01.2021 06:00:00.000,1.3654,1.36682,1.36523,1.36551,2021-01-20 06:00:00+00:00
20.01.2021 07:00:00.000,1.3655,1.36707,1.36534,1.36692,2021-01-20 07:00:00+00:00
20.01.2021 08:00:00.000,1.3669,1.3678,1.36576,1.3678,2021-01-20 08:00:00+00:00
20.01.2021 09:00:00.000,1.36778,1.36985,1.36761,1.36902,2021-01-20 09:00:00+00:00
20.01.2021 10:00:00.000,1.36906,1.37186,1.36856,1.37038,2021-01-20 10:00:00+00:00
20.01.2021 11:00:00.000,1.37036,1.37051,1.36746,1.36781,2021-01-20 11:00:00+00:00
20.01.2021 12:00:00.000,1.3678,1.36852,1.36606,1.3669,2021-01-20 12:00:00+00:00
20.01.2021 13:00:00.000,1.3669,1.3673,1.36591,1.36724,2021-01-20 13:00:00+00:00
20.01.2021 14:00:00.000,1.36725,1.36802,1.3634,1.36368,2021-01-20 14:00:00+00:00
20.01.2021 15:00:00.000,1.36368,1.36649,1.36241,1.36319,2021-01-20 15:00:00+00:00
20.01.2021 16:00:00.000,1.36321,1.36594,1.3623,1.36589,2021-01-20 16:00:00+00:00
20.01.2021 17:00:00.000,1.36589,1.36592,1.36395,1.36418,2021-01-20 17:00:00+00:00
20.01.2021 18:00:00.000,1.3642,1.36477,1.36356,1.36471,2021-01-20 18:00:00+00:00
20.01.2021 19:00:00.000,1.36468,1.36468,1.36408,1.36442,2021-01-20 19:00:00+00:00
20.01.2021 20:00:00.000,1.36443,1.36583,1.36428,1.36575,2021-01-20 20:00:00+00:00
20.01.2021 21:00:00.000,1.36575,1.36599,1.36497,1.36497,2021-01-20 21:00:00+00:00
20.01.2021 22:00:00.000,1.36497,1.36582,1.36463,1.36529,2021-01-20 22:00:00+00:00
20.01.2021 23:00:00.000,1.36527,1.36738,1.36517,1.36662,2021-01-20 23:00:00+00:00
21.01.2021 00:00:00.000,1.36663,1.36696,1.36583,1.36695,2021-01-21 00:00:00+00:00
21.01.2021 01:00:00.000,1.36695,1.36818,1.36679,1.36728,2021-01-21 01:00:00+00:00
21.01.2021 02:00:00.000,1.36729,1.36841,1.36697,1.36815,2021-01-21 02:00:00+00:00
21.01.2021 03:00:00.000,1.36819,1.36838,1.36768,1.3681,2021-01-21 03:00:00+00:00
21.01.2021 04:00:00.000,1.36814,1.36838,1.36784,1.36825,2021-01-21 04:00:00+00:00
21.01.2021 05:00:00.000,1.36827,1.36944,1.36794,1.36937,2021-01-21 05:00:00+00:00
21.01.2021 06:00:00.000,1.3694,1.37089,1.36924,1.37073,2021-01-21 06:00:00+00:00
21.01.2021 07:00:00.000,1.37072,1.37103,1.36913,1.36967,2021-01-21 07:00:00+00:00
21.01.2021 08:00:00.000,1.36966,1.37303,1.3694,1.37293,2021-01-21 08:00:00+00:00
21.01.2021 09:00:00.000,1.37293,1.37456,1.37256,1.37333,2021-01-21 09:00:00+00:00
21.01.2021 10:00:00.000,1.37334,1.37363,1.3718,1.37313,2021-01-21 10:00:00+00:00
21.01.2021 11:00:00.000,1.37313,1.37357,1.37121,1.37189,2021-01-21 11:00:00+00:00
21.01.2021 12:00:00.000,1.3719,1.37326,1.37081,1.37107,2021-01-21 12:00:00+00:00
21.01.2021 13:00:00.000,1.37111,1.37324,1.37085,1.37113,2021-01-21 13:00:00+00:00
21.01.2021 14:00:00.000,1.37114,1.37312,1.37067,1.37266,2021-01-21 14:00:00+00:00
21.01.2021 15:00:00.000,1.37266,1.37398,1.37224,1.37245,2021-01-21 15:00:00+00:00
21.01.2021 16:00:00.000,1.37248,1.37354,1.37117,1.37194,2021-01-21 16:00:00+00:00
21.01.2021 17:00:00.000,1.37195,1.37213,1.37051,1.37099,2021-01-21 17:00:00+00:00
21.01.2021 18:00:00.000,1.37099,1.37134,1.37031,1.37106,2021-01-21 18:00:00+00:00
21.01.2021 19:00:00.000,1.37106,1.37256,1.37102,1.37246,2021-01-21 19:00:00+00:00
21.01.2021 20:00:00.000,1.37244,1.37381,1.37207,1.37374,2021-01-21 20:00:00+00:00
21.01.2021 21:00:00.000,1.37372,1.3738,1.37286,1.37304,2021-01-21 21:00:00+00:00
21.01.2021 22:00:00.000,1.37305,1.3735,1.373,1.37307,2021-01-21 22:00:00+00:00
21.01.2021 23:00:00.000,1.3731,1.37343,1.37272,1.37283,2021-01-21 23:00:00+00:00
22.01.2021 00:00:00.000,1.37284,1.37359,1.37271,1.37284,2021-01-22 00:00:00+00:00
22.01.2021 01:00:00.000,1.37284,1.37284,1.37144,1.37162,2021-01-22 01:00:00+00:00
22.01.2021 02:00:00.000,1.3716,1.37214,1.37078,1.3717,2021-01-22 02:00:00+00:00
22.01.2021 03:00:00.000,1.37171,1.37209,1.37084,1.37168,2021-01-22 03:00:00+00:00
22.01.2021 04:00:00.000,1.37167,1.37189,1.37102,1.37109,2021-01-22 04:00:00+00:00
22.01.2021 05:00:00.000,1.37108,1.37134,1.37037,1.37066,2021-01-22 05:00:00+00:00
22.01.2021 06:00:00.000,1.37065,1.37066,1.36915,1.36947,2021-01-22 06:00:00+00:00
22.01.2021 07:00:00.000,1.36945,1.36945,1.36619,1.3668,2021-01-22 07:00:00+00:00
22.01.2021 08:00:00.000,1.36686,1.3696,1.36546,1.36918,2021-01-22 08:00:00+00:00
22.01.2021 09:00:00.000,1.36922,1.36992,1.36512,1.36673,2021-01-22 09:00:00+00:00
22.01.2021 10:00:00.000,1.36673,1.36687,1.36543,1.36593,2021-01-22 10:00:00+00:00
22.01.2021 11:00:00.000,1.36594,1.36758,1.36592,1.36679,2021-01-22 11:00:00+00:00
22.01.2021 12:00:00.000,1.36676,1.36766,1.36572,1.36607,2021-01-22 12:00:00+00:00
22.01.2021 13:00:00.000,1.36606,1.36607,1.36355,1.36467,2021-01-22 13:00:00+00:00
22.01.2021 14:00:00.000,1.36464,1.36629,1.3641,1.36613,2021-01-22 14:00:00+00:00
22.01.2021 15:00:00.000,1.36611,1.36731,1.36542,1.3669,2021-01-22 15:00:00+00:00
22.01.2021 16:00:00.000,1.36697,1.36846,1.36621,1.36826,2021-01-22 16:00:00+00:00
22.01.2021 17:00:00.000,1.36829,1.36843,1.36706,1.36791,2021-01-22 17:00:00+00:00
22.01.2021 18:00:00.000,1.36791,1.36846,1.36756,1.36809,2021-01-22 18:00:00+00:00
22.01.2021 19:00:00.000,1.36813,1.36928,1.36812,1.36819,2021-01-22 19:00:00+00:00
22.01.2021 20:00:00.000,1.36818,1.36848,1.36731,1.36801,2021-01-22 20:00:00+00:00
22.01.2021 21:00:00.000,1.368,1.36875,1.36784,1.36784,2021-01-22 21:00:00+00:00
22.01.2021 22:00:00.000,1.36784,1.36784,1.36784,1.36784,2021-01-22 22:00:00+00:00
22.01.2021 23:00:00.000,1.36784,1.36784,1.36784,1.36784,2021-01-22 23:00:00+00:00
23.01.2021 00:00:00.000,1.36784,1.36784,1.36784,1.36784,2021-01-23 00:00:00+00:00
23.01.2021 01:00:00.000,1.36784,1.36784,1.36784,1.36784,2021-01-23 01:00:00+00:00
23.01.2021 02:00:00.000,1.36784,1.36784,1.36784,1.36784,2021-01-23 02:00:00+00:00
23.01.2021 03:00:00.000,1.36784,1.36784,1.36784,1.36784,2021-01-23 03:00:00+00:00
23.01.2021 04:00:00.000,1.36784,1.36784,1.36784,1.36784,2021-01-23 04:00:00+00:00
23.01.2021 05:00:00.000,1.36784,1.36784,1.36784,1.36784,2021-01-23 05:00:00+00:00
23.01.2021 06:00:00.000,1.36784,1.36784,1.36784,1.36784,2021-01-23 06:00:00+00:00
23.01.2021 07:00:00.000,1.36784,1.36784,1.36784,1.36784,2021-01-23 07:00:00+00:00
23.01.2021 08:00:00.000,1.36784,1.36784,1.36784,1.36784,2021-01-23 08:00:00+00:00
23.01.2021 09:00:00.000,1.36784,1.36784,1.36784,1.36784,2021-01-23 09:00:00+00:00
23.01.2021 10:00:00.000,1.36784,1.36784,1.36784,1.36784,2021-01-23 10:00:00+00:00
23.01.2021 11:00:00.000,1.36784,1.36784,1.36784,1.36784,2021-01-23 11:00:00+00:00
23.01.2021 12:00:00.000,1.36784,1.36784,1.36784,1.36784,2021-01-23 12:00:00+00:00
23.01.2021 13:00:00.000,1.36784,1.36784,1.36784,1.36784,2021-01-23 13:00:00+00:00
23.01.2021 14:00:00.000,1.36784,1.36784,1.36784,1.36784,2021-01-23 14:00:00+00:00
23.01.2021 15:00:00.000,1.36784,1.36784,1.36784,1.36784,2021-01-23 15:00:00+00:00
23.01.2021 16:00:00.000,1.36784,1.36784,1.36784,1.36784,2021-01-23 16:00:00+00:00
23.01.2021 17:00:00.000,1.36784,1.36784,1.36784,1.36784,2021-01-23 17:00:00+00:00
23.01.2021 18:00:00.000,1.36784,1.36784,1.36784,1.36784,2021-01-23 18:00:00+00:00
23.01.2021 19:00:00.000,1.36784,1.36784,1.36784,1.36784,2021-01-23 19:00:00+00:00
23.01.2021 20:00:00.000,1.36784,1.36784,1.36784,1.36784,2021-01-23 20:00:00+00:00
23.01.2021 21:00:00.000,1.36784,1.36784,1.36784,1.36784,2021-01-23 21:00:00+00:00
23.01.2021 22:00:00.000,1.36784,1.36784,1.36784,1.36784,2021-01-23 22:00:00+00:00
23.01.2021 23:00:00.000,1.36784,1.36784,1.36784,1.36784,2021-01-23 23:00:00+00:00
24.01.2021 00:00:00.000,1.36784,1.36784,1.36784,1.36784,2021-01-24 00:00:00+00:00
24.01.2021 01:00:00.000,1.36784,1.36784,1.36784,1.36784,2021-01-24 01:00:00+00:00
24.01.2021 02:00:00.000,1.36784,1.36784,1.36784,1.36784,2021-01-24 02:00:00+00:00
24.01.2021 03:00:00.000,1.36784,1.36784,1.36784,1.36784,2021-01-24 03:00:00+00:00
24.01.2021 04:00:00.000,1.36784,1.36784,1.36784,1.36784,2021-01-24 04:00:00+00:00
24.01.2021 05:00:00.000,1.36784,1.36784,1.36784,1.36784,2021-01-24 05:00:00+00:00
24.01.2021 06:00:00.000,1.36784,1.36784,1.36784,1.36784,2021-01-24 06:00:00+00:00
24.01.2021 07:00:00.000,1.36784,1.36784,1.36784,1.36784,2021-01-24 07:00:00+00:00
24.01.2021 08:00:00.000,1.36784,1.36784,1.36784,1.36784,2021-01-24 08:00:00+00:00
24.01.2021 09:00:00.000,1.36784,1.36784,1.36784,1.36784,2021-01-24 09:00:00+00:00
24.01.2021 10:00:00.000,1.36784,1.36784,1.36784,1.36784,2021-01-24 10:00:00+00:00
24.01.2021 11:00:00.000,1.36784,1.36784,1.36784,1.36784,2021-01-24 11:00:00+00:00
24.01.2021 12:00:00.000,1.36784,1.36784,1.36784,1.36784,2021-01-24 12:00:00+00:00
24.01.2021 13:00:00.000,1.36784,1.36784,1.36784,1.36784,2021-01-24 13:00:00+00:00
24.01.2021 14:00:00.000,1.36784,1.36784,1.36784,1.36784,2021-01-24 14:00:00+00:00
24.01.2021 15:00:00.000,1.36784,1.36784,1.36784,1.36784,2021-01-24 15:00:00+00:00
24.01.2021 16:00:00.000,1.36784,1.36784,1.36784,1.36784,2021-01-24 16:00:00+00:00
24.01.2021 17:00:00.000,1.36784,1.36784,1.36784,1.36784,2021-01-24 17:00:00+00:00
24.01.2021 18:00:00.000,1.36784,1.36784,1.36784,1.36784,2021-01-24 18:00:00+00:00
24.01.2021 19:00:00.000,1.36784,1.36784,1.36784,1.36784,2021-01-24 19:00:00+00:00
24.01.2021 20:00:00.000,1.36784,1.36784,1.36784,1.36784,2021-01-24 20:00:00+00:00
24.01.2021 21:00:00.000,1.36784,1.36784,1.36784,1.36784,2021-01-24 21:00:00+00:00
24.01.2021 22:00:00.000,1.36763,1.36834,1.36722,1.36762,2021-01-24 22:00:00+00:00
24.01.2021 23:00:00.000,1.36788,1.36909,1.36784,1.3685,2021-01-24 23:00:00+00:00
25.01.2021 00:00:00.000,1.36853,1.36905,1.36785,1.36845,2021-01-25 00:00:00+00:00
25.01.2021 01:00:00.000,1.36846,1.36876,1.36774,1.36819,2021-01-25 01:00:00+00:00
25.01.2021 02:00:00.000,1.36817,1.37014,1.36817,1.36985,2021-01-25 02:00:00+00:00
25.01.2021 03:00:00.000,1.36986,1.3707,1.36973,1.37007,2021-01-25 03:00:00+00:00
25.01.2021 04:00:00.000,1.37006,1.3708,1.36992,1.37034,2021-01-25 04:00:00+00:00
25.01.2021 05:00:00.000,1.37034,1.37153,1.37033,1.37146,2021-01-25 05:00:00+00:00
25.01.2021 06:00:00.000,1.37147,1.37232,1.37126,1.37147,2021-01-25 06:00:00+00:00
25.01.2021 07:00:00.000,1.37151,1.37209,1.37037,1.37191,2021-01-25 07:00:00+00:00
25.01.2021 08:00:00.000,1.3719,1.37205,1.36927,1.37002,2021-01-25 08:00:00+00:00
25.01.2021 09:00:00.000,1.37004,1.37027,1.36658,1.36732,2021-01-25 09:00:00+00:00
25.01.2021 10:00:00.000,1.36732,1.36976,1.36675,1.36953,2021-01-25 10:00:00+00:00
25.01.2021 11:00:00.000,1.36953,1.36991,1.3685,1.36895,2021-01-25 11:00:00+00:00
25.01.2021 12:00:00.000,1.36896,1.36908,1.36715,1.3682,2021-01-25 12:00:00+00:00
25.01.2021 13:00:00.000,1.36819,1.36954,1.36742,1.36824,2021-01-25 13:00:00+00:00
25.01.2021 14:00:00.000,1.36824,1.36908,1.3655,1.36578,2021-01-25 14:00:00+00:00
25.01.2021 15:00:00.000,1.36577,1.36753,1.36517,1.36707,2021-01-25 15:00:00+00:00
25.01.2021 16:00:00.000,1.36706,1.36717,1.36484,1.36655,2021-01-25 16:00:00+00:00
25.01.2021 17:00:00.000,1.36653,1.36822,1.36639,1.36696,2021-01-25 17:00:00+00:00
25.01.2021 18:00:00.000,1.36696,1.36748,1.36664,1.36743,2021-01-25 18:00:00+00:00
25.01.2021 19:00:00.000,1.36745,1.3677,1.36591,1.36629,2021-01-25 19:00:00+00:00
25.01.2021 20:00:00.000,1.36626,1.36706,1.36592,1.36693,2021-01-25 20:00:00+00:00
25.01.2021 21:00:00.000,1.36692,1.36768,1.36625,1.36743,2021-01-25 21:00:00+00:00
25.01.2021 22:00:00.000,1.36744,1.36757,1.36576,1.36727,2021-01-25 22:00:00+00:00
25.01.2021 23:00:00.000,1.36727,1.36793,1.36714,1.36765,2021-01-25 23:00:00+00:00
26.01.2021 00:00:00.000,1.36768,1.36768,1.36637,1.3666,2021-01-26 00:00:00+00:00
26.01.2021 01:00:00.000,1.36661,1.36752,1.36597,1.36747,2021-01-26 01:00:00+00:00
26.01.2021 02:00:00.000,1.36747,1.36769,1.36695,1.36712,2021-01-26 02:00:00+00:00
26.01.2021 03:00:00.000,1.36714,1.36719,1.36598,1.36639,2021-01-26 03:00:00+00:00
26.01.2021 04:00:00.000,1.36639,1.36662,1.36459,1.36491,2021-01-26 04:00:00+00:00
26.01.2021 05:00:00.000,1.36491,1.36537,1.36465,1.36532,2021-01-26 05:00:00+00:00
26.01.2021 06:00:00.000,1.3653,1.3654,1.36327,1.36384,2021-01-26 06:00:00+00:00
26.01.2021 07:00:00.000,1.36384,1.36475,1.36092,1.36117,2021-01-26 07:00:00+00:00
26.01.2021 08:00:00.000,1.36119,1.3644,1.36108,1.36396,2021-01-26 08:00:00+00:00
26.01.2021 09:00:00.000,1.36395,1.36646,1.36378,1.36583,2021-01-26 09:00:00+00:00
26.01.2021 10:00:00.000,1.36583,1.36609,1.36443,1.36543,2021-01-26 10:00:00+00:00
26.01.2021 11:00:00.000,1.36541,1.36762,1.36537,1.36744,2021-01-26 11:00:00+00:00
26.01.2021 12:00:00.000,1.36745,1.3701,1.36706,1.36948,2021-01-26 12:00:00+00:00
26.01.2021 13:00:00.000,1.36949,1.3714,1.3688,1.37077,2021-01-26 13:00:00+00:00
26.01.2021 14:00:00.000,1.37078,1.37266,1.37058,1.37241,2021-01-26 14:00:00+00:00
26.01.2021 15:00:00.000,1.3724,1.37442,1.37226,1.37418,2021-01-26 15:00:00+00:00
26.01.2021 16:00:00.000,1.37419,1.37429,1.37176,1.3727,2021-01-26 16:00:00+00:00
26.01.2021 17:00:00.000,1.37269,1.37344,1.37229,1.37313,2021-01-26 17:00:00+00:00
26.01.2021 18:00:00.000,1.37313,1.37394,1.37274,1.37323,2021-01-26 18:00:00+00:00
26.01.2021 19:00:00.000,1.37327,1.37368,1.37285,1.37314,2021-01-26 19:00:00+00:00
26.01.2021 20:00:00.000,1.37315,1.37396,1.37309,1.37395,2021-01-26 20:00:00+00:00
26.01.2021 21:00:00.000,1.37394,1.3741,1.3733,1.3736,2021-01-26 21:00:00+00:00
26.01.2021 22:00:00.000,1.37362,1.37379,1.37302,1.37336,2021-01-26 22:00:00+00:00
26.01.2021 23:00:00.000,1.37337,1.37425,1.37333,1.3741,2021-01-26 23:00:00+00:00
27.01.2021 00:00:00.000,1.37408,1.37517,1.37382,1.37409,2021-01-27 00:00:00+00:00
27.01.2021 01:00:00.000,1.37409,1.37438,1.37298,1.37326,2021-01-27 01:00:00+00:00
27.01.2021 02:00:00.000,1.37324,1.37339,1.37263,1.37332,2021-01-27 02:00:00+00:00
27.01.2021 03:00:00.000,1.37333,1.37356,1.37283,1.37285,2021-01-27 03:00:00+00:00
27.01.2021 04:00:00.000,1.37283,1.37343,1.37225,1.37305,2021-01-27 04:00:00+00:00
27.01.2021 05:00:00.000,1.37303,1.37443,1.37295,1.37426,2021-01-27 05:00:00+00:00
27.01.2021 06:00:00.000,1.37425,1.37473,1.37346,1.37423,2021-01-27 06:00:00+00:00
27.01.2021 07:00:00.000,1.37424,1.37585,1.37351,1.37533,2021-01-27 07:00:00+00:00
27.01.2021 08:00:00.000,1.37533,1.37577,1.37255,1.37358,2021-01-27 08:00:00+00:00
27.01.2021 09:00:00.000,1.37359,1.37438,1.37206,1.37346,2021-01-27 09:00:00+00:00
27.01.2021 10:00:00.000,1.37342,1.37445,1.37301,1.37416,2021-01-27 10:00:00+00:00
27.01.2021 11:00:00.000,1.37414,1.37423,1.36985,1.3711,2021-01-27 11:00:00+00:00
27.01.2021 12:00:00.000,1.37107,1.37225,1.36925,1.37027,2021-01-27 12:00:00+00:00
27.01.2021 13:00:00.000,1.37032,1.37074,1.36811,1.36942,2021-01-27 13:00:00+00:00
27.01.2021 14:00:00.000,1.36944,1.36991,1.36588,1.36776,2021-01-27 14:00:00+00:00
27.01.2021 15:00:00.000,1.36777,1.37111,1.36754,1.37031,2021-01-27 15:00:00+00:00
27.01.2021 16:00:00.000,1.3703,1.37083,1.36871,1.36874,2021-01-27 16:00:00+00:00
27.01.2021 17:00:00.000,1.36873,1.37132,1.3684,1.37123,2021-01-27 17:00:00+00:00
27.01.2021 18:00:00.000,1.37124,1.37217,1.37075,1.37206,2021-01-27 18:00:00+00:00
27.01.2021 19:00:00.000,1.37212,1.37298,1.36807,1.36861,2021-01-27 19:00:00+00:00
27.01.2021 20:00:00.000,1.3686,1.36959,1.36727,1.3681,2021-01-27 20:00:00+00:00
27.01.2021 21:00:00.000,1.36812,1.36964,1.36757,1.36846,2021-01-27 21:00:00+00:00
27.01.2021 22:00:00.000,1.36847,1.36923,1.36768,1.36907,2021-01-27 22:00:00+00:00
27.01.2021 23:00:00.000,1.36908,1.36921,1.36656,1.36705,2021-01-27 23:00:00+00:00
28.01.2021 00:00:00.000,1.36702,1.36755,1.36508,1.36613,2021-01-28 00:00:00+00:00
28.01.2021 01:00:00.000,1.36612,1.36828,1.36584,1.36775,2021-01-28 01:00:00+00:00
28.01.2021 02:00:00.000,1.36775,1.36805,1.36617,1.36695,2021-01-28 02:00:00+00:00
28.01.2021 03:00:00.000,1.36696,1.36696,1.36609,1.36675,2021-01-28 03:00:00+00:00
28.01.2021 04:00:00.000,1.36674,1.36705,1.36635,1.36702,2021-01-28 04:00:00+00:00
28.01.2021 05:00:00.000,1.36705,1.36803,1.36683,1.36792,2021-01-28 05:00:00+00:00
28.01.2021 06:00:00.000,1.36792,1.36793,1.36672,1.36768,2021-01-28 06:00:00+00:00
28.01.2021 07:00:00.000,1.36766,1.36767,1.36393,1.36574,2021-01-28 07:00:00+00:00
28.01.2021 08:00:00.000,1.36575,1.36691,1.36327,1.36334,2021-01-28 08:00:00+00:00
28.01.2021 09:00:00.000,1.36332,1.36549,1.36298,1.365,2021-01-28 09:00:00+00:00
28.01.2021 10:00:00.000,1.36498,1.36746,1.36375,1.36673,2021-01-28 10:00:00+00:00
28.01.2021 11:00:00.000,1.36673,1.3676,1.36479,1.36479,2021-01-28 11:00:00+00:00
28.01.2021 12:00:00.000,1.36479,1.36584,1.36382,1.3653,2021-01-28 12:00:00+00:00
28.01.2021 13:00:00.000,1.36527,1.3684,1.36396,1.3682,2021-01-28 13:00:00+00:00
28.01.2021 14:00:00.000,1.3682,1.37181,1.36809,1.37083,2021-01-28 14:00:00+00:00
28.01.2021 15:00:00.000,1.37084,1.37334,1.3707,1.37194,2021-01-28 15:00:00+00:00
28.01.2021 16:00:00.000,1.37194,1.37295,1.37109,1.37257,2021-01-28 16:00:00+00:00
28.01.2021 17:00:00.000,1.37258,1.37289,1.37185,1.37256,2021-01-28 17:00:00+00:00
28.01.2021 18:00:00.000,1.37257,1.37425,1.37247,1.37368,2021-01-28 18:00:00+00:00
28.01.2021 19:00:00.000,1.37367,1.37457,1.37355,1.37407,2021-01-28 19:00:00+00:00
28.01.2021 20:00:00.000,1.37407,1.37453,1.37311,1.3732,2021-01-28 20:00:00+00:00
28.01.2021 21:00:00.000,1.37317,1.37323,1.37176,1.37181,2021-01-28 21:00:00+00:00
28.01.2021 22:00:00.000,1.37186,1.37322,1.37162,1.37263,2021-01-28 22:00:00+00:00
28.01.2021 23:00:00.000,1.37263,1.37293,1.3722,1.37244,2021-01-28 23:00:00+00:00
29.01.2021 00:00:00.000,1.37244,1.37262,1.37065,1.37108,2021-01-29 00:00:00+00:00
29.01.2021 01:00:00.000,1.37107,1.37272,1.37097,1.37144,2021-01-29 01:00:00+00:00
29.01.2021 02:00:00.000,1.37146,1.37171,1.37064,1.3713,2021-01-29 02:00:00+00:00
29.01.2021 03:00:00.000,1.37131,1.37157,1.37029,1.37039,2021-01-29 03:00:00+00:00
29.01.2021 04:00:00.000,1.3704,1.37097,1.36952,1.37079,2021-01-29 04:00:00+00:00
29.01.2021 05:00:00.000,1.37074,1.3708,1.36989,1.37034,2021-01-29 05:00:00+00:00
29.01.2021 06:00:00.000,1.37035,1.37157,1.36996,1.37131,2021-01-29 06:00:00+00:00
29.01.2021 07:00:00.000,1.37131,1.37188,1.36923,1.36984,2021-01-29 07:00:00+00:00
29.01.2021 08:00:00.000,1.36983,1.37011,1.36715,1.36899,2021-01-29 08:00:00+00:00
29.01.2021 09:00:00.000,1.36899,1.36924,1.3657,1.36666,2021-01-29 09:00:00+00:00
29.01.2021 10:00:00.000,1.36666,1.36927,1.3657,1.36913,2021-01-29 10:00:00+00:00
29.01.2021 11:00:00.000,1.36913,1.37134,1.36849,1.37095,2021-01-29 11:00:00+00:00
29.01.2021 12:00:00.000,1.37094,1.37385,1.37091,1.37273,2021-01-29 12:00:00+00:00
29.01.2021 13:00:00.000,1.37273,1.37493,1.37183,1.37389,2021-01-29 13:00:00+00:00
29.01.2021 14:00:00.000,1.37389,1.37512,1.37163,1.37238,2021-01-29 14:00:00+00:00
29.01.2021 15:00:00.000,1.37238,1.3736,1.37,1.37275,2021-01-29 15:00:00+00:00
29.01.2021 16:00:00.000,1.37274,1.37351,1.37061,1.37223,2021-01-29 16:00:00+00:00
29.01.2021 17:00:00.000,1.37226,1.37317,1.37005,1.37054,2021-01-29 17:00:00+00:00
29.01.2021 18:00:00.000,1.37056,1.37174,1.36964,1.37091,2021-01-29 18:00:00+00:00
29.01.2021 19:00:00.000,1.37093,1.37202,1.36998,1.37009,2021-01-29 19:00:00+00:00
29.01.2021 20:00:00.000,1.3701,1.3716,1.36929,1.3698,2021-01-29 20:00:00+00:00
29.01.2021 21:00:00.000,1.3698,1.37054,1.36915,1.37023,2021-01-29 21:00:00+00:00
29.01.2021 22:00:00.000,1.37023,1.37023,1.37023,1.37023,2021-01-29 22:00:00+00:00
29.01.2021 23:00:00.000,1.37023,1.37023,1.37023,1.37023,2021-01-29 23:00:00+00:00
30.01.2021 00:00:00.000,1.37023,1.37023,1.37023,1.37023,2021-01-30 00:00:00+00:00
30.01.2021 01:00:00.000,1.37023,1.37023,1.37023,1.37023,2021-01-30 01:00:00+00:00
30.01.2021 02:00:00.000,1.37023,1.37023,1.37023,1.37023,2021-01-30 02:00:00+00:00
30.01.2021 03:00:00.000,1.37023,1.37023,1.37023,1.37023,2021-01-30 03:00:00+00:00
30.01.2021 04:00:00.000,1.37023,1.37023,1.37023,1.37023,2021-01-30 04:00:00+00:00
30.01.2021 05:00:00.000,1.37023,1.37023,1.37023,1.37023,2021-01-30 05:00:00+00:00
30.01.2021 06:00:00.000,1.37023,1.37023,1.37023,1.37023,2021-01-30 06:00:00+00:00
30.01.2021 07:00:00.000,1.37023,1.37023,1.37023,1.37023,2021-01-30 07:00:00+00:00
30.01.2021 08:00:00.000,1.37023,1.37023,1.37023,1.37023,2021-01-30 08:00:00+00:00
30.01.2021 09:00:00.000,1.37023,1.37023,1.37023,1.37023,2021-01-30 09:00:00+00:00
30.01.2021 10:00:00.000,1.37023,1.37023,1.37023,1.37023,2021-01-30 10:00:00+00:00
30.01.2021 11:00:00.000,1.37023,1.37023,1.37023,1.37023,2021-01-30 11:00:00+00:00
30.01.2021 12:00:00.000,1.37023,1.37023,1.37023,1.37023,2021-01-30 12:00:00+00:00
30.01.2021 13:00:00.000,1.37023,1.37023,1.37023,1.37023,2021-01-30 13:00:00+00:00
30.01.2021 14:00:00.000,1.37023,1.37023,1.37023,1.37023,2021-01-30 14:00:00+00:00
30.01.2021 15:00:00.000,1.37023,1.37023,1.37023,1.37023,2021-01-30 15:00:00+00:00
30.01.2021 16:00:00.000,1.37023,1.37023,1.37023,1.37023,2021-01-30 16:00:00+00:00
30.01.2021 17:00:00.000,1.37023,1.37023,1.37023,1.37023,2021-01-30 17:00:00+00:00
30.01.2021 18:00:00.000,1.37023,1.37023,1.37023,1.37023,2021-01-30 18:00:00+00:00
30.01.2021 19:00:00.000,1.37023,1.37023,1.37023,1.37023,2021-01-30 19:00:00+00:00
30.01.2021 20:00:00.000,1.37023,1.37023,1.37023,1.37023,2021-01-30 20:00:00+00:00
30.01.2021 21:00:00.000,1.37023,1.37023,1.37023,1.37023,2021-01-30 21:00:00+00:00
30.01.2021 22:00:00.000,1.37023,1.37023,1.37023,1.37023,2021-01-30 22:00:00+00:00
30.01.2021 23:00:00.000,1.37023,1.37023,1.37023,1.37023,2021-01-30 23:00:00+00:00
31.01.2021 00:00:00.000,1.37023,1.37023,1.37023,1.37023,2021-01-31 00:00:00+00:00
31.01.2021 01:00:00.000,1.37023,1.37023,1.37023,1.37023,2021-01-31 01:00:00+00:00
31.01.2021 02:00:00.000,1.37023,1.37023,1.37023,1.37023,2021-01-31 02:00:00+00:00
31.01.2021 03:00:00.000,1.37023,1.37023,1.37023,1.37023,2021-01-31 03:00:00+00:00
31.01.2021 04:00:00.000,1.37023,1.37023,1.37023,1.37023,2021-01-31 04:00:00+00:00
31.01.2021 05:00:00.000,1.37023,1.37023,1.37023,1.37023,2021-01-31 05:00:00+00:00
31.01.2021 06:00:00.000,1.37023,1.37023,1.37023,1.37023,2021-01-31 06:00:00+00:00
31.01.2021 07:00:00.000,1.37023,1.37023,1.37023,1.37023,2021-01-31 07:00:00+00:00
31.01.2021 08:00:00.000,1.37023,1.37023,1.37023,1.37023,2021-01-31 08:00:00+00:00
31.01.2021 09:00:00.000,1.37023,1.37023,1.37023,1.37023,2021-01-31 09:00:00+00:00
31.01.2021 10:00:00.000,1.37023,1.37023,1.37023,1.37023,2021-01-31 10:00:00+00:00
31.01.2021 11:00:00.000,1.37023,1.37023,1.37023,1.37023,2021-01-31 11:00:00+00:00
31.01.2021 12:00:00.000,1.37023,1.37023,1.37023,1.37023,2021-01-31 12:00:00+00:00
31.01.2021 13:00:00.000,1.37023,1.37023,1.37023,1.37023,2021-01-31 13:00:00+00:00
31.01.2021 14:00:00.000,1.37023,1.37023,1.37023,1.37023,2021-01-31 14:00:00+00:00
31.01.2021 15:00:00.000,1.37023,1.37023,1.37023,1.37023,2021-01-31 15:00:00+00:00
31.01.2021 16:00:00.000,1.37023,1.37023,1.37023,1.37023,2021-01-31 16:00:00+00:00
31.01.2021 17:00:00.000,1.37023,1.37023,1.37023,1.37023,2021-01-31 17:00:00+00:00
31.01.2021 18:00:00.000,1.37023,1.37023,1.37023,1.37023,2021-01-31 18:00:00+00:00
31.01.2021 19:00:00.000,1.37023,1.37023,1.37023,1.37023,2021-01-31 19:00:00+00:00
31.01.2021 20:00:00.000,1.37023,1.37023,1.37023,1.37023,2021-01-31 20:00:00+00:00
31.01.2021 21:00:00.000,1.37023,1.37023,1.37023,1.37023,2021-01-31 21:00:00+00:00
31.01.2021 22:00:00.000,1.37052,1.37077,1.36983,1.37043,2021-01-31 22:00:00+00:00
31.01.2021 23:00:00.000,1.37043,1.37078,1.36935,1.36971,2021-01-31 23:00:00+00:00
02.02.2021 00:00:00.000,1.36752,1.36752,1.36645,1.36698,2021-02-02 00:00:00+00:00
02.02.2021 01:00:00.000,1.36697,1.36943,1.3669,1.36926,2021-02-02 01:00:00+00:00
02.02.2021 02:00:00.000,1.36928,1.36953,1.36866,1.36926,2021-02-02 02:00:00+00:00
02.02.2021 03:00:00.000,1.36926,1.36978,1.36898,1.36934,2021-02-02 03:00:00+00:00
02.02.2021 04:00:00.000,1.36935,1.3694,1.36811,1.36836,2021-02-02 04:00:00+00:00
02.02.2021 05:00:00.000,1.36836,1.36874,1.36798,1.36866,2021-02-02 05:00:00+00:00
02.02.2021 06:00:00.000,1.36866,1.3687,1.36734,1.36817,2021-02-02 06:00:00+00:00
02.02.2021 07:00:00.000,1.36817,1.36935,1.36706,1.36765,2021-02-02 07:00:00+00:00
02.02.2021 08:00:00.000,1.36765,1.37039,1.36757,1.37017,2021-02-02 08:00:00+00:00
02.02.2021 09:00:00.000,1.37015,1.37101,1.36834,1.36869,2021-02-02 09:00:00+00:00
02.02.2021 10:00:00.000,1.36871,1.36935,1.36713,1.36725,2021-02-02 10:00:00+00:00
02.02.2021 11:00:00.000,1.36723,1.36817,1.36638,1.36716,2021-02-02 11:00:00+00:00
02.02.2021 12:00:00.000,1.36715,1.36808,1.36636,1.36647,2021-02-02 12:00:00+00:00
02.02.2021 13:00:00.000,1.36646,1.36743,1.36498,1.36612,2021-02-02 13:00:00+00:00
02.02.2021 14:00:00.000,1.36613,1.36619,1.36108,1.36152,2021-02-02 14:00:00+00:00
02.02.2021 15:00:00.000,1.36156,1.36377,1.36154,1.3628,2021-02-02 15:00:00+00:00
02.02.2021 16:00:00.000,1.36283,1.36493,1.36271,1.36424,2021-02-02 16:00:00+00:00
02.02.2021 17:00:00.000,1.36421,1.36522,1.36399,1.36464,2021-02-02 17:00:00+00:00
02.02.2021 18:00:00.000,1.36463,1.36558,1.36459,1.36477,2021-02-02 18:00:00+00:00
02.02.2021 19:00:00.000,1.3648,1.36563,1.36439,1.36535,2021-02-02 19:00:00+00:00
02.02.2021 20:00:00.000,1.36535,1.36622,1.36457,1.36594,2021-02-02 20:00:00+00:00
02.02.2021 21:00:00.000,1.36595,1.3669,1.36554,1.36669,2021-02-02 21:00:00+00:00
02.02.2021 22:00:00.000,1.3667,1.36684,1.3656,1.36603,2021-02-02 22:00:00+00:00
02.02.2021 23:00:00.000,1.3661,1.36688,1.3659,1.3659,2021-02-02 23:00:00+00:00
03.02.2021 00:00:00.000,1.3659,1.36705,1.3659,1.36675,2021-03-02 00:00:00+00:00
03.02.2021 01:00:00.000,1.36677,1.368,1.36646,1.36785,2021-03-02 01:00:00+00:00
03.02.2021 02:00:00.000,1.36785,1.36832,1.36732,1.36736,2021-03-02 02:00:00+00:00
03.02.2021 03:00:00.000,1.36741,1.36741,1.3664,1.3667,2021-03-02 03:00:00+00:00
03.02.2021 04:00:00.000,1.36671,1.36692,1.3662,1.3665,2021-03-02 04:00:00+00:00
03.02.2021 05:00:00.000,1.3665,1.36679,1.36592,1.36615,2021-03-02 05:00:00+00:00
03.02.2021 06:00:00.000,1.36615,1.36619,1.36448,1.36526,2021-03-02 06:00:00+00:00
03.02.2021 07:00:00.000,1.36523,1.36718,1.36453,1.36708,2021-03-02 07:00:00+00:00
03.02.2021 08:00:00.000,1.3671,1.3678,1.36584,1.36587,2021-03-02 08:00:00+00:00
03.02.2021 09:00:00.000,1.36589,1.36619,1.36372,1.36372,2021-03-02 09:00:00+00:00
03.02.2021 10:00:00.000,1.36378,1.36454,1.36281,1.36416,2021-03-02 10:00:00+00:00
03.02.2021 11:00:00.000,1.36413,1.36468,1.36301,1.36304,2021-03-02 11:00:00+00:00
03.02.2021 12:00:00.000,1.36305,1.36376,1.36189,1.36276,2021-03-02 12:00:00+00:00
03.02.2021 13:00:00.000,1.36275,1.36533,1.3625,1.36479,2021-03-02 13:00:00+00:00
03.02.2021 14:00:00.000,1.36479,1.36681,1.3637,1.36655,2021-03-02 14:00:00+00:00
03.02.2021 15:00:00.000,1.36655,1.36686,1.36407,1.36442,2021-03-02 15:00:00+00:00
03.02.2021 16:00:00.000,1.36441,1.3662,1.36439,1.36498,2021-03-02 16:00:00+00:00
03.02.2021 17:00:00.000,1.36497,1.36613,1.36415,1.36573,2021-03-02 17:00:00+00:00
03.02.2021 18:00:00.000,1.36575,1.36582,1.36355,1.36405,2021-03-02 18:00:00+00:00
03.02.2021 19:00:00.000,1.36402,1.36448,1.36398,1.36415,2021-03-02 19:00:00+00:00
03.02.2021 20:00:00.000,1.36417,1.36435,1.36318,1.3637,2021-03-02 20:00:00+00:00
03.02.2021 21:00:00.000,1.36373,1.36478,1.36357,1.36435,2021-03-02 21:00:00+00:00
03.02.2021 22:00:00.000,1.36437,1.36446,1.36378,1.36445,2021-03-02 22:00:00+00:00
03.02.2021 23:00:00.000,1.36446,1.36524,1.36429,1.36493,2021-03-02 23:00:00+00:00
04.02.2021 00:00:00.000,1.36494,1.36513,1.36377,1.3638,2021-04-02 00:00:00+00:00
04.02.2021 01:00:00.000,1.36382,1.36435,1.36365,1.36365,2021-04-02 01:00:00+00:00
04.02.2021 02:00:00.000,1.36366,1.36468,1.36363,1.3638,2021-04-02 02:00:00+00:00
04.02.2021 03:00:00.000,1.36381,1.36405,1.3606,1.36115,2021-04-02 03:00:00+00:00
04.02.2021 04:00:00.000,1.36114,1.36162,1.36077,1.36097,2021-04-02 04:00:00+00:00
04.02.2021 05:00:00.000,1.36099,1.36099,1.35956,1.36049,2021-04-02 05:00:00+00:00
04.02.2021 06:00:00.000,1.36046,1.36112,1.35948,1.36007,2021-04-02 06:00:00+00:00
04.02.2021 07:00:00.000,1.36008,1.36008,1.35852,1.35908,2021-04-02 07:00:00+00:00
04.02.2021 08:00:00.000,1.35907,1.35983,1.35776,1.35815,2021-04-02 08:00:00+00:00
04.02.2021 09:00:00.000,1.35817,1.36015,1.35722,1.35841,2021-04-02 09:00:00+00:00
04.02.2021 10:00:00.000,1.35839,1.35951,1.35724,1.35755,2021-04-02 10:00:00+00:00
04.02.2021 11:00:00.000,1.35758,1.35851,1.35655,1.35669,2021-04-02 11:00:00+00:00
04.02.2021 12:00:00.000,1.35671,1.3665,1.35668,1.36643,2021-04-02 12:00:00+00:00
04.02.2021 13:00:00.000,1.36644,1.36978,1.36642,1.36807,2021-04-02 13:00:00+00:00
04.02.2021 14:00:00.000,1.36806,1.36873,1.3659,1.36729,2021-04-02 14:00:00+00:00
04.02.2021 15:00:00.000,1.36726,1.36795,1.36527,1.36572,2021-04-02 15:00:00+00:00
04.02.2021 16:00:00.000,1.36572,1.36659,1.36541,1.36635,2021-04-02 16:00:00+00:00
04.02.2021 17:00:00.000,1.36638,1.36659,1.36548,1.36601,2021-04-02 17:00:00+00:00
04.02.2021 18:00:00.000,1.36601,1.36652,1.36506,1.36622,2021-04-02 18:00:00+00:00
04.02.2021 19:00:00.000,1.36623,1.36771,1.36599,1.36743,2021-04-02 19:00:00+00:00
04.02.2021 20:00:00.000,1.36746,1.36766,1.36719,1.36759,2021-04-02 20:00:00+00:00
04.02.2021 21:00:00.000,1.36761,1.36765,1.36691,1.36715,2021-04-02 21:00:00+00:00
04.02.2021 22:00:00.000,1.36715,1.36715,1.36613,1.36649,2021-04-02 22:00:00+00:00
04.02.2021 23:00:00.000,1.36648,1.36785,1.36647,1.36719,2021-04-02 23:00:00+00:00
05.02.2021 00:00:00.000,1.3672,1.36894,1.36712,1.36891,2021-05-02 00:00:00+00:00
05.02.2021 01:00:00.000,1.36889,1.3689,1.36798,1.36823,2021-05-02 01:00:00+00:00
05.02.2021 02:00:00.000,1.3682,1.36859,1.36679,1.36681,2021-05-02 02:00:00+00:00
05.02.2021 03:00:00.000,1.36684,1.36744,1.36657,1.36708,2021-05-02 03:00:00+00:00
05.02.2021 04:00:00.000,1.36709,1.36757,1.36709,1.36742,2021-05-02 04:00:00+00:00
05.02.2021 05:00:00.000,1.36742,1.36816,1.36728,1.36812,2021-05-02 05:00:00+00:00
05.02.2021 06:00:00.000,1.36813,1.36871,1.36787,1.36841,2021-05-02 06:00:00+00:00
05.02.2021 07:00:00.000,1.36841,1.36841,1.3675,1.36818,2021-05-02 07:00:00+00:00
05.02.2021 08:00:00.000,1.36816,1.37067,1.36809,1.37011,2021-05-02 08:00:00+00:00
05.02.2021 09:00:00.000,1.37012,1.3712,1.369,1.36902,2021-05-02 09:00:00+00:00
05.02.2021 10:00:00.000,1.36901,1.37024,1.36809,1.36835,2021-05-02 10:00:00+00:00
05.02.2021 11:00:00.000,1.36835,1.36919,1.36717,1.36887,2021-05-02 11:00:00+00:00
05.02.2021 12:00:00.000,1.36886,1.37019,1.36829,1.36974,2021-05-02 12:00:00+00:00
05.02.2021 13:00:00.000,1.36972,1.37188,1.36862,1.37042,2021-05-02 13:00:00+00:00
05.02.2021 14:00:00.000,1.3704,1.37274,1.37,1.37198,2021-05-02 14:00:00+00:00
05.02.2021 15:00:00.000,1.37199,1.37397,1.37163,1.37233,2021-05-02 15:00:00+00:00
05.02.2021 16:00:00.000,1.37239,1.37317,1.37099,1.37136,2021-05-02 16:00:00+00:00
05.02.2021 17:00:00.000,1.37135,1.37334,1.37119,1.3733,2021-05-02 17:00:00+00:00
05.02.2021 18:00:00.000,1.37331,1.37331,1.37221,1.37222,2021-05-02 18:00:00+00:00
05.02.2021 19:00:00.000,1.3722,1.37312,1.37211,1.37272,2021-05-02 19:00:00+00:00
05.02.2021 20:00:00.000,1.37271,1.37389,1.37269,1.37382,2021-05-02 20:00:00+00:00
05.02.2021 21:00:00.000,1.3738,1.37385,1.37288,1.37291,2021-05-02 21:00:00+00:00
05.02.2021 22:00:00.000,1.37291,1.37291,1.37291,1.37291,2021-05-02 22:00:00+00:00
05.02.2021 23:00:00.000,1.37291,1.37291,1.37291,1.37291,2021-05-02 23:00:00+00:00
06.02.2021 00:00:00.000,1.37291,1.37291,1.37291,1.37291,2021-06-02 00:00:00+00:00
06.02.2021 01:00:00.000,1.37291,1.37291,1.37291,1.37291,2021-06-02 01:00:00+00:00
06.02.2021 02:00:00.000,1.37291,1.37291,1.37291,1.37291,2021-06-02 02:00:00+00:00
06.02.2021 03:00:00.000,1.37291,1.37291,1.37291,1.37291,2021-06-02 03:00:00+00:00
06.02.2021 04:00:00.000,1.37291,1.37291,1.37291,1.37291,2021-06-02 04:00:00+00:00
06.02.2021 05:00:00.000,1.37291,1.37291,1.37291,1.37291,2021-06-02 05:00:00+00:00
06.02.2021 06:00:00.000,1.37291,1.37291,1.37291,1.37291,2021-06-02 06:00:00+00:00
06.02.2021 07:00:00.000,1.37291,1.37291,1.37291,1.37291,2021-06-02 07:00:00+00:00
06.02.2021 08:00:00.000,1.37291,1.37291,1.37291,1.37291,2021-06-02 08:00:00+00:00
06.02.2021 09:00:00.000,1.37291,1.37291,1.37291,1.37291,2021-06-02 09:00:00+00:00
06.02.2021 10:00:00.000,1.37291,1.37291,1.37291,1.37291,2021-06-02 10:00:00+00:00
06.02.2021 11:00:00.000,1.37291,1.37291,1.37291,1.37291,2021-06-02 11:00:00+00:00
06.02.2021 12:00:00.000,1.37291,1.37291,1.37291,1.37291,2021-06-02 12:00:00+00:00
06.02.2021 13:00:00.000,1.37291,1.37291,1.37291,1.37291,2021-06-02 13:00:00+00:00
06.02.2021 14:00:00.000,1.37291,1.37291,1.37291,1.37291,2021-06-02 14:00:00+00:00
06.02.2021 15:00:00.000,1.37291,1.37291,1.37291,1.37291,2021-06-02 15:00:00+00:00
06.02.2021 16:00:00.000,1.37291,1.37291,1.37291,1.37291,2021-06-02 16:00:00+00:00
06.02.2021 17:00:00.000,1.37291,1.37291,1.37291,1.37291,2021-06-02 17:00:00+00:00
06.02.2021 18:00:00.000,1.37291,1.37291,1.37291,1.37291,2021-06-02 18:00:00+00:00
06.02.2021 19:00:00.000,1.37291,1.37291,1.37291,1.37291,2021-06-02 19:00:00+00:00
06.02.2021 20:00:00.000,1.37291,1.37291,1.37291,1.37291,2021-06-02 20:00:00+00:00
06.02.2021 21:00:00.000,1.37291,1.37291,1.37291,1.37291,2021-06-02 21:00:00+00:00
06.02.2021 22:00:00.000,1.37291,1.37291,1.37291,1.37291,2021-06-02 22:00:00+00:00
06.02.2021 23:00:00.000,1.37291,1.37291,1.37291,1.37291,2021-06-02 23:00:00+00:00
07.02.2021 00:00:00.000,1.37291,1.37291,1.37291,1.37291,2021-07-02 00:00:00+00:00
07.02.2021 01:00:00.000,1.37291,1.37291,1.37291,1.37291,2021-07-02 01:00:00+00:00
07.02.2021 02:00:00.000,1.37291,1.37291,1.37291,1.37291,2021-07-02 02:00:00+00:00
07.02.2021 03:00:00.000,1.37291,1.37291,1.37291,1.37291,2021-07-02 03:00:00+00:00
07.02.2021 04:00:00.000,1.37291,1.37291,1.37291,1.37291,2021-07-02 04:00:00+00:00
07.02.2021 05:00:00.000,1.37291,1.37291,1.37291,1.37291,2021-07-02 05:00:00+00:00
07.02.2021 06:00:00.000,1.37291,1.37291,1.37291,1.37291,2021-07-02 06:00:00+00:00
07.02.2021 07:00:00.000,1.37291,1.37291,1.37291,1.37291,2021-07-02 07:00:00+00:00
07.02.2021 08:00:00.000,1.37291,1.37291,1.37291,1.37291,2021-07-02 08:00:00+00:00
07.02.2021 09:00:00.000,1.37291,1.37291,1.37291,1.37291,2021-07-02 09:00:00+00:00
07.02.2021 10:00:00.000,1.37291,1.37291,1.37291,1.37291,2021-07-02 10:00:00+00:00
07.02.2021 11:00:00.000,1.37291,1.37291,1.37291,1.37291,2021-07-02 11:00:00+00:00
07.02.2021 12:00:00.000,1.37291,1.37291,1.37291,1.37291,2021-07-02 12:00:00+00:00
07.02.2021 13:00:00.000,1.37291,1.37291,1.37291,1.37291,2021-07-02 13:00:00+00:00
07.02.2021 14:00:00.000,1.37291,1.37291,1.37291,1.37291,2021-07-02 14:00:00+00:00
07.02.2021 15:00:00.000,1.37291,1.37291,1.37291,1.37291,2021-07-02 15:00:00+00:00
07.02.2021 16:00:00.000,1.37291,1.37291,1.37291,1.37291,2021-07-02 16:00:00+00:00
07.02.2021 17:00:00.000,1.37291,1.37291,1.37291,1.37291,2021-07-02 17:00:00+00:00
07.02.2021 18:00:00.000,1.37291,1.37291,1.37291,1.37291,2021-07-02 18:00:00+00:00
07.02.2021 19:00:00.000,1.37291,1.37291,1.37291,1.37291,2021-07-02 19:00:00+00:00
07.02.2021 20:00:00.000,1.37291,1.37291,1.37291,1.37291,2021-07-02 20:00:00+00:00
07.02.2021 21:00:00.000,1.37291,1.37291,1.37291,1.37291,2021-07-02 21:00:00+00:00
07.02.2021 22:00:00.000,1.37151,1.37339,1.37135,1.37261,2021-07-02 22:00:00+00:00
07.02.2021 23:00:00.000,1.37302,1.37398,1.37287,1.37372,2021-07-02 23:00:00+00:00
08.02.2021 00:00:00.000,1.37371,1.37409,1.37248,1.37255,2021-08-02 00:00:00+00:00
08.02.2021 01:00:00.000,1.3726,1.37324,1.37231,1.37324,2021-08-02 01:00:00+00:00
08.02.2021 02:00:00.000,1.37323,1.37324,1.37226,1.37301,2021-08-02 02:00:00+00:00
08.02.2021 03:00:00.000,1.37301,1.37334,1.37281,1.37331,2021-08-02 03:00:00+00:00
08.02.2021 04:00:00.000,1.37332,1.3735,1.37251,1.37251,2021-08-02 04:00:00+00:00
08.02.2021 05:00:00.000,1.37252,1.37332,1.3725,1.37289,2021-08-02 05:00:00+00:00
08.02.2021 06:00:00.000,1.37288,1.37314,1.3725,1.37293,2021-08-02 06:00:00+00:00
08.02.2021 07:00:00.000,1.37297,1.3741,1.37279,1.3735,2021-08-02 07:00:00+00:00
08.02.2021 08:00:00.000,1.3735,1.37403,1.3705,1.37111,2021-08-02 08:00:00+00:00
08.02.2021 09:00:00.000,1.3711,1.37185,1.37021,1.37064,2021-08-02 09:00:00+00:00
08.02.2021 10:00:00.000,1.37064,1.37114,1.36854,1.36907,2021-08-02 10:00:00+00:00
08.02.2021 11:00:00.000,1.3691,1.36994,1.36823,1.36829,2021-08-02 11:00:00+00:00
08.02.2021 12:00:00.000,1.36828,1.36947,1.368,1.36897,2021-08-02 12:00:00+00:00
08.02.2021 13:00:00.000,1.36896,1.37011,1.36845,1.36947,2021-08-02 13:00:00+00:00
08.02.2021 14:00:00.000,1.36947,1.37291,1.36931,1.37265,2021-08-02 14:00:00+00:00
08.02.2021 15:00:00.000,1.37264,1.37491,1.37259,1.37392,2021-08-02 15:00:00+00:00
08.02.2021 16:00:00.000,1.37392,1.37444,1.37215,1.37372,2021-08-02 16:00:00+00:00
08.02.2021 17:00:00.000,1.3737,1.37429,1.37345,1.37413,2021-08-02 17:00:00+00:00
08.02.2021 18:00:00.000,1.37412,1.37438,1.3737,1.37394,2021-08-02 18:00:00+00:00
08.02.2021 19:00:00.000,1.37394,1.37442,1.37375,1.37435,2021-08-02 19:00:00+00:00
08.02.2021 20:00:00.000,1.37434,1.37436,1.37307,1.37417,2021-08-02 20:00:00+00:00
08.02.2021 21:00:00.000,1.37418,1.3743,1.37358,1.37379,2021-08-02 21:00:00+00:00
08.02.2021 22:00:00.000,1.37359,1.37406,1.37347,1.37371,2021-08-02 22:00:00+00:00
08.02.2021 23:00:00.000,1.3737,1.37451,1.3737,1.3745,2021-08-02 23:00:00+00:00
09.02.2021 00:00:00.000,1.3745,1.3756,1.37419,1.3753,2021-09-02 00:00:00+00:00
09.02.2021 01:00:00.000,1.37531,1.37602,1.37484,1.37571,2021-09-02 01:00:00+00:00
09.02.2021 02:00:00.000,1.37571,1.37836,1.37537,1.37815,2021-09-02 02:00:00+00:00
09.02.2021 03:00:00.000,1.3782,1.37825,1.37753,1.37762,2021-09-02 03:00:00+00:00
09.02.2021 04:00:00.000,1.37762,1.37812,1.37742,1.37767,2021-09-02 04:00:00+00:00
09.02.2021 05:00:00.000,1.37766,1.3784,1.37762,1.37828,2021-09-02 05:00:00+00:00
09.02.2021 06:00:00.000,1.37829,1.37872,1.37688,1.37727,2021-09-02 06:00:00+00:00
09.02.2021 07:00:00.000,1.37728,1.37861,1.3771,1.37819,2021-09-02 07:00:00+00:00
09.02.2021 08:00:00.000,1.37819,1.37845,1.37619,1.3775,2021-09-02 08:00:00+00:00
09.02.2021 09:00:00.000,1.37749,1.37889,1.37685,1.37806,2021-09-02 09:00:00+00:00
09.02.2021 10:00:00.000,1.37806,1.37815,1.37647,1.37671,2021-09-02 10:00:00+00:00
09.02.2021 11:00:00.000,1.37671,1.37811,1.37609,1.37778,2021-09-02 11:00:00+00:00
09.02.2021 12:00:00.000,1.37775,1.3778,1.37686,1.37773,2021-09-02 12:00:00+00:00
09.02.2021 13:00:00.000,1.37775,1.37888,1.37694,1.37832,2021-09-02 13:00:00+00:00
09.02.2021 14:00:00.000,1.37832,1.3794,1.37718,1.37887,2021-09-02 14:00:00+00:00
09.02.2021 15:00:00.000,1.37885,1.37974,1.37774,1.37959,2021-09-02 15:00:00+00:00
09.02.2021 16:00:00.000,1.37959,1.37965,1.37812,1.3794,2021-09-02 16:00:00+00:00
09.02.2021 17:00:00.000,1.37942,1.37982,1.37921,1.37974,2021-09-02 17:00:00+00:00
09.02.2021 18:00:00.000,1.37973,1.38026,1.37902,1.38014,2021-09-02 18:00:00+00:00
09.02.2021 19:00:00.000,1.38014,1.38156,1.37998,1.38125,2021-09-02 19:00:00+00:00
09.02.2021 20:00:00.000,1.38124,1.3816,1.38077,1.38144,2021-09-02 20:00:00+00:00
09.02.2021 21:00:00.000,1.38148,1.38203,1.38108,1.38154,2021-09-02 21:00:00+00:00
09.02.2021 22:00:00.000,1.38154,1.38157,1.38061,1.38125,2021-09-02 22:00:00+00:00
09.02.2021 23:00:00.000,1.38126,1.38173,1.38124,1.3815,2021-09-02 23:00:00+00:00
10.02.2021 00:00:00.000,1.38153,1.38158,1.38068,1.38108,2021-10-02 00:00:00+00:00
10.02.2021 01:00:00.000,1.38113,1.38169,1.38023,1.38151,2021-10-02 01:00:00+00:00
10.02.2021 02:00:00.000,1.38151,1.38235,1.38142,1.38223,2021-10-02 02:00:00+00:00
10.02.2021 03:00:00.000,1.38224,1.38272,1.38214,1.38225,2021-10-02 03:00:00+00:00
10.02.2021 04:00:00.000,1.38226,1.38265,1.38197,1.38213,2021-10-02 04:00:00+00:00
10.02.2021 05:00:00.000,1.38212,1.38224,1.3817,1.38203,2021-10-02 05:00:00+00:00
10.02.2021 06:00:00.000,1.38205,1.38224,1.38165,1.38186,2021-10-02 06:00:00+00:00
10.02.2021 07:00:00.000,1.38187,1.38289,1.381,1.3828,2021-10-02 07:00:00+00:00
10.02.2021 08:00:00.000,1.38281,1.38556,1.38196,1.38545,2021-10-02 08:00:00+00:00
10.02.2021 09:00:00.000,1.38544,1.38553,1.38338,1.38343,2021-10-02 09:00:00+00:00
10.02.2021 10:00:00.000,1.38343,1.38485,1.38337,1.38406,2021-10-02 10:00:00+00:00
10.02.2021 11:00:00.000,1.38408,1.38514,1.38368,1.38375,2021-10-02 11:00:00+00:00
10.02.2021 12:00:00.000,1.38375,1.38387,1.38277,1.38354,2021-10-02 12:00:00+00:00
10.02.2021 13:00:00.000,1.38353,1.38515,1.38308,1.38482,2021-10-02 13:00:00+00:00
10.02.2021 14:00:00.000,1.3848,1.38658,1.38425,1.38427,2021-10-02 14:00:00+00:00
10.02.2021 15:00:00.000,1.38426,1.38624,1.38375,1.38452,2021-10-02 15:00:00+00:00
10.02.2021 16:00:00.000,1.38452,1.38505,1.38387,1.38483,2021-10-02 16:00:00+00:00
10.02.2021 17:00:00.000,1.38482,1.38517,1.3839,1.38515,2021-10-02 17:00:00+00:00
10.02.2021 18:00:00.000,1.38515,1.38529,1.38428,1.38456,2021-10-02 18:00:00+00:00
10.02.2021 19:00:00.000,1.38457,1.38517,1.38387,1.38404,2021-10-02 19:00:00+00:00
10.02.2021 20:00:00.000,1.38404,1.38408,1.38275,1.38335,2021-10-02 20:00:00+00:00
10.02.2021 21:00:00.000,1.38336,1.38362,1.38303,1.38303,2021-10-02 21:00:00+00:00
10.02.2021 22:00:00.000,1.38299,1.38358,1.38227,1.38303,2021-10-02 22:00:00+00:00
10.02.2021 23:00:00.000,1.38298,1.38335,1.38284,1.38302,2021-10-02 23:00:00+00:00
11.02.2021 00:00:00.000,1.38302,1.38305,1.38206,1.38221,2021-11-02 00:00:00+00:00
11.02.2021 01:00:00.000,1.38223,1.38291,1.38215,1.38285,2021-11-02 01:00:00+00:00
11.02.2021 02:00:00.000,1.38284,1.38346,1.38267,1.38337,2021-11-02 02:00:00+00:00
11.02.2021 03:00:00.000,1.38339,1.38453,1.38325,1.38448,2021-11-02 03:00:00+00:00
11.02.2021 04:00:00.000,1.38448,1.38505,1.38446,1.38478,2021-11-02 04:00:00+00:00
11.02.2021 05:00:00.000,1.38477,1.38517,1.38455,1.38466,2021-11-02 05:00:00+00:00
11.02.2021 06:00:00.000,1.38464,1.38541,1.38414,1.38532,2021-11-02 06:00:00+00:00
11.02.2021 07:00:00.000,1.38533,1.38593,1.38387,1.38396,2021-11-02 07:00:00+00:00
11.02.2021 08:00:00.000,1.38397,1.38423,1.38133,1.38172,2021-11-02 08:00:00+00:00
11.02.2021 09:00:00.000,1.38175,1.38371,1.38139,1.38346,2021-11-02 09:00:00+00:00
11.02.2021 10:00:00.000,1.38347,1.38355,1.38192,1.38208,2021-11-02 10:00:00+00:00
11.02.2021 11:00:00.000,1.38208,1.38293,1.38191,1.38261,2021-11-02 11:00:00+00:00
11.02.2021 12:00:00.000,1.38259,1.38343,1.3823,1.38312,2021-11-02 12:00:00+00:00
11.02.2021 13:00:00.000,1.38312,1.38449,1.38295,1.38361,2021-11-02 13:00:00+00:00
11.02.2021 14:00:00.000,1.38362,1.38367,1.38118,1.38131,2021-11-02 14:00:00+00:00
11.02.2021 15:00:00.000,1.38131,1.38326,1.38124,1.38175,2021-11-02 15:00:00+00:00
11.02.2021 16:00:00.000,1.38177,1.38218,1.38089,1.38199,2021-11-02 16:00:00+00:00
11.02.2021 17:00:00.000,1.38197,1.38203,1.38001,1.38108,2021-11-02 17:00:00+00:00
11.02.2021 18:00:00.000,1.3811,1.38151,1.38042,1.38139,2021-11-02 18:00:00+00:00
11.02.2021 19:00:00.000,1.38138,1.38146,1.3803,1.38037,2021-11-02 19:00:00+00:00
11.02.2021 20:00:00.000,1.38038,1.38193,1.38032,1.38161,2021-11-02 20:00:00+00:00
11.02.2021 21:00:00.000,1.3816,1.38177,1.38109,1.38143,2021-11-02 21:00:00+00:00
11.02.2021 22:00:00.000,1.38127,1.38173,1.38102,1.3816,2021-11-02 22:00:00+00:00
11.02.2021 23:00:00.000,1.38162,1.38164,1.38059,1.38109,2021-11-02 23:00:00+00:00
12.02.2021 00:00:00.000,1.38107,1.3814,1.38047,1.38069,2021-12-02 00:00:00+00:00
12.02.2021 01:00:00.000,1.38068,1.3809,1.3801,1.38019,2021-12-02 01:00:00+00:00
12.02.2021 02:00:00.000,1.38019,1.38019,1.37869,1.37887,2021-12-02 02:00:00+00:00
12.02.2021 03:00:00.000,1.37884,1.37925,1.37859,1.37902,2021-12-02 03:00:00+00:00
12.02.2021 04:00:00.000,1.37901,1.37931,1.37898,1.37915,2021-12-02 04:00:00+00:00
12.02.2021 05:00:00.000,1.37913,1.38012,1.3791,1.38004,2021-12-02 05:00:00+00:00
12.02.2021 06:00:00.000,1.38005,1.38005,1.37929,1.37998,2021-12-02 06:00:00+00:00
12.02.2021 07:00:00.000,1.37998,1.38014,1.3785,1.37923,2021-12-02 07:00:00+00:00
12.02.2021 08:00:00.000,1.37927,1.38067,1.3778,1.37782,2021-12-02 08:00:00+00:00
12.02.2021 09:00:00.000,1.37783,1.37901,1.37754,1.3788,2021-12-02 09:00:00+00:00
12.02.2021 10:00:00.000,1.37878,1.37999,1.37828,1.37907,2021-12-02 10:00:00+00:00
12.02.2021 11:00:00.000,1.37906,1.37907,1.37795,1.37821,2021-12-02 11:00:00+00:00
12.02.2021 12:00:00.000,1.3782,1.38103,1.37807,1.38046,2021-12-02 12:00:00+00:00
12.02.2021 13:00:00.000,1.38045,1.38062,1.37872,1.37997,2021-12-02 13:00:00+00:00
12.02.2021 14:00:00.000,1.37996,1.38292,1.37946,1.38201,2021-12-02 14:00:00+00:00
12.02.2021 15:00:00.000,1.382,1.38496,1.38167,1.3848,2021-12-02 15:00:00+00:00
12.02.2021 16:00:00.000,1.38482,1.38555,1.38434,1.3854,2021-12-02 16:00:00+00:00
12.02.2021 17:00:00.000,1.3854,1.38609,1.38533,1.38586,2021-12-02 17:00:00+00:00
12.02.2021 18:00:00.000,1.38586,1.38605,1.38519,1.38603,2021-12-02 18:00:00+00:00
12.02.2021 19:00:00.000,1.38605,1.38623,1.38478,1.38488,2021-12-02 19:00:00+00:00
12.02.2021 20:00:00.000,1.38487,1.38523,1.38453,1.38511,2021-12-02 20:00:00+00:00
12.02.2021 21:00:00.000,1.38508,1.38557,1.38473,1.38497,2021-12-02 21:00:00+00:00
12.02.2021 22:00:00.000,1.38497,1.38497,1.38497,1.38497,2021-12-02 22:00:00+00:00
12.02.2021 23:00:00.000,1.38497,1.38497,1.38497,1.38497,2021-12-02 23:00:00+00:00
13.02.2021 00:00:00.000,1.38497,1.38497,1.38497,1.38497,2021-02-13 00:00:00+00:00
13.02.2021 01:00:00.000,1.38497,1.38497,1.38497,1.38497,2021-02-13 01:00:00+00:00
13.02.2021 02:00:00.000,1.38497,1.38497,1.38497,1.38497,2021-02-13 02:00:00+00:00
13.02.2021 03:00:00.000,1.38497,1.38497,1.38497,1.38497,2021-02-13 03:00:00+00:00
13.02.2021 04:00:00.000,1.38497,1.38497,1.38497,1.38497,2021-02-13 04:00:00+00:00
13.02.2021 05:00:00.000,1.38497,1.38497,1.38497,1.38497,2021-02-13 05:00:00+00:00
13.02.2021 06:00:00.000,1.38497,1.38497,1.38497,1.38497,2021-02-13 06:00:00+00:00
13.02.2021 07:00:00.000,1.38497,1.38497,1.38497,1.38497,2021-02-13 07:00:00+00:00
13.02.2021 08:00:00.000,1.38497,1.38497,1.38497,1.38497,2021-02-13 08:00:00+00:00
13.02.2021 09:00:00.000,1.38497,1.38497,1.38497,1.38497,2021-02-13 09:00:00+00:00
13.02.2021 10:00:00.000,1.38497,1.38497,1.38497,1.38497,2021-02-13 10:00:00+00:00
13.02.2021 11:00:00.000,1.38497,1.38497,1.38497,1.38497,2021-02-13 11:00:00+00:00
13.02.2021 12:00:00.000,1.38497,1.38497,1.38497,1.38497,2021-02-13 12:00:00+00:00
13.02.2021 13:00:00.000,1.38497,1.38497,1.38497,1.38497,2021-02-13 13:00:00+00:00
13.02.2021 14:00:00.000,1.38497,1.38497,1.38497,1.38497,2021-02-13 14:00:00+00:00
13.02.2021 15:00:00.000,1.38497,1.38497,1.38497,1.38497,2021-02-13 15:00:00+00:00
13.02.2021 16:00:00.000,1.38497,1.38497,1.38497,1.38497,2021-02-13 16:00:00+00:00
13.02.2021 17:00:00.000,1.38497,1.38497,1.38497,1.38497,2021-02-13 17:00:00+00:00
13.02.2021 18:00:00.000,1.38497,1.38497,1.38497,1.38497,2021-02-13 18:00:00+00:00
13.02.2021 19:00:00.000,1.38497,1.38497,1.38497,1.38497,2021-02-13 19:00:00+00:00
13.02.2021 20:00:00.000,1.38497,1.38497,1.38497,1.38497,2021-02-13 20:00:00+00:00
13.02.2021 21:00:00.000,1.38497,1.38497,1.38497,1.38497,2021-02-13 21:00:00+00:00
13.02.2021 22:00:00.000,1.38497,1.38497,1.38497,1.38497,2021-02-13 22:00:00+00:00
13.02.2021 23:00:00.000,1.38497,1.38497,1.38497,1.38497,2021-02-13 23:00:00+00:00
14.02.2021 00:00:00.000,1.38497,1.38497,1.38497,1.38497,2021-02-14 00:00:00+00:00
14.02.2021 01:00:00.000,1.38497,1.38497,1.38497,1.38497,2021-02-14 01:00:00+00:00
14.02.2021 02:00:00.000,1.38497,1.38497,1.38497,1.38497,2021-02-14 02:00:00+00:00
14.02.2021 03:00:00.000,1.38497,1.38497,1.38497,1.38497,2021-02-14 03:00:00+00:00
14.02.2021 04:00:00.000,1.38497,1.38497,1.38497,1.38497,2021-02-14 04:00:00+00:00
14.02.2021 05:00:00.000,1.38497,1.38497,1.38497,1.38497,2021-02-14 05:00:00+00:00
14.02.2021 06:00:00.000,1.38497,1.38497,1.38497,1.38497,2021-02-14 06:00:00+00:00
14.02.2021 07:00:00.000,1.38497,1.38497,1.38497,1.38497,2021-02-14 07:00:00+00:00
14.02.2021 08:00:00.000,1.38497,1.38497,1.38497,1.38497,2021-02-14 08:00:00+00:00
14.02.2021 09:00:00.000,1.38497,1.38497,1.38497,1.38497,2021-02-14 09:00:00+00:00
14.02.2021 10:00:00.000,1.38497,1.38497,1.38497,1.38497,2021-02-14 10:00:00+00:00
14.02.2021 11:00:00.000,1.38497,1.38497,1.38497,1.38497,2021-02-14 11:00:00+00:00
14.02.2021 12:00:00.000,1.38497,1.38497,1.38497,1.38497,2021-02-14 12:00:00+00:00
14.02.2021 13:00:00.000,1.38497,1.38497,1.38497,1.38497,2021-02-14 13:00:00+00:00
14.02.2021 14:00:00.000,1.38497,1.38497,1.38497,1.38497,2021-02-14 14:00:00+00:00
14.02.2021 15:00:00.000,1.38497,1.38497,1.38497,1.38497,2021-02-14 15:00:00+00:00
14.02.2021 16:00:00.000,1.38497,1.38497,1.38497,1.38497,2021-02-14 16:00:00+00:00
14.02.2021 17:00:00.000,1.38497,1.38497,1.38497,1.38497,2021-02-14 17:00:00+00:00
14.02.2021 18:00:00.000,1.38497,1.38497,1.38497,1.38497,2021-02-14 18:00:00+00:00
14.02.2021 19:00:00.000,1.38497,1.38497,1.38497,1.38497,2021-02-14 19:00:00+00:00
14.02.2021 20:00:00.000,1.38497,1.38497,1.38497,1.38497,2021-02-14 20:00:00+00:00
14.02.2021 21:00:00.000,1.38497,1.38497,1.38497,1.38497,2021-02-14 21:00:00+00:00
14.02.2021 22:00:00.000,1.38482,1.38606,1.38482,1.38564,2021-02-14 22:00:00+00:00
14.02.2021 23:00:00.000,1.38563,1.38712,1.38556,1.38687,2021-02-14 23:00:00+00:00
15.02.2021 00:00:00.000,1.38685,1.3878,1.38653,1.38737,2021-02-15 00:00:00+00:00
15.02.2021 01:00:00.000,1.38738,1.38903,1.3872,1.38889,2021-02-15 01:00:00+00:00
15.02.2021 02:00:00.000,1.38888,1.39012,1.38838,1.3898,2021-02-15 02:00:00+00:00
15.02.2021 03:00:00.000,1.38981,1.39019,1.38939,1.3898,2021-02-15 03:00:00+00:00
15.02.2021 04:00:00.000,1.38978,1.39025,1.38939,1.38949,2021-02-15 04:00:00+00:00
15.02.2021 05:00:00.000,1.38952,1.39018,1.38951,1.38999,2021-02-15 05:00:00+00:00
15.02.2021 06:00:00.000,1.39,1.39002,1.38889,1.38897,2021-02-15 06:00:00+00:00
15.02.2021 07:00:00.000,1.38895,1.39096,1.38838,1.3903,2021-02-15 07:00:00+00:00
15.02.2021 08:00:00.000,1.39031,1.39141,1.3896,1.38999,2021-02-15 08:00:00+00:00
15.02.2021 09:00:00.000,1.38998,1.39011,1.38902,1.38982,2021-02-15 09:00:00+00:00
15.02.2021 10:00:00.000,1.38982,1.3913,1.38969,1.39053,2021-02-15 10:00:00+00:00
15.02.2021 11:00:00.000,1.39054,1.39113,1.39038,1.39057,2021-02-15 11:00:00+00:00
15.02.2021 12:00:00.000,1.39058,1.3912,1.38989,1.39105,2021-02-15 12:00:00+00:00
15.02.2021 13:00:00.000,1.39103,1.39115,1.38935,1.38969,2021-02-15 13:00:00+00:00
15.02.2021 14:00:00.000,1.38971,1.39056,1.38959,1.3901,2021-02-15 14:00:00+00:00
15.02.2021 15:00:00.000,1.3901,1.39125,1.38981,1.39122,2021-02-15 15:00:00+00:00
15.02.2021 16:00:00.000,1.39122,1.39188,1.39078,1.39185,2021-02-15 16:00:00+00:00
15.02.2021 17:00:00.000,1.39186,1.39188,1.39086,1.39112,2021-02-15 17:00:00+00:00
15.02.2021 18:00:00.000,1.3911,1.39148,1.39019,1.39034,2021-02-15 18:00:00+00:00
15.02.2021 19:00:00.000,1.39036,1.3908,1.39022,1.3906,2021-02-15 19:00:00+00:00
15.02.2021 20:00:00.000,1.39061,1.39084,1.39026,1.39051,2021-02-15 20:00:00+00:00
15.02.2021 21:00:00.000,1.39051,1.39101,1.38988,1.38988,2021-02-15 21:00:00+00:00
15.02.2021 22:00:00.000,1.38987,1.39092,1.38987,1.39076,2021-02-15 22:00:00+00:00
15.02.2021 23:00:00.000,1.3908,1.39147,1.39044,1.39138,2021-02-15 23:00:00+00:00
16.02.2021 00:00:00.000,1.39135,1.39285,1.39116,1.39248,2021-02-16 00:00:00+00:00
16.02.2021 01:00:00.000,1.3925,1.39452,1.39207,1.39393,2021-02-16 01:00:00+00:00
16.02.2021 02:00:00.000,1.39389,1.39493,1.39375,1.3949,2021-02-16 02:00:00+00:00
16.02.2021 03:00:00.000,1.39485,1.39515,1.3945,1.39489,2021-02-16 03:00:00+00:00
16.02.2021 04:00:00.000,1.39488,1.39489,1.39394,1.39395,2021-02-16 04:00:00+00:00
16.02.2021 05:00:00.000,1.39396,1.3944,1.39256,1.39333,2021-02-16 05:00:00+00:00
16.02.2021 06:00:00.000,1.39335,1.39369,1.3924,1.39299,2021-02-16 06:00:00+00:00
16.02.2021 07:00:00.000,1.39305,1.39357,1.39107,1.39109,2021-02-16 07:00:00+00:00
16.02.2021 08:00:00.000,1.39108,1.39319,1.39083,1.39303,2021-02-16 08:00:00+00:00
16.02.2021 09:00:00.000,1.39306,1.39415,1.39231,1.39298,2021-02-16 09:00:00+00:00
16.02.2021 10:00:00.000,1.39299,1.39397,1.39154,1.39335,2021-02-16 10:00:00+00:00
16.02.2021 11:00:00.000,1.39334,1.39403,1.39208,1.39252,2021-02-16 11:00:00+00:00
16.02.2021 12:00:00.000,1.39253,1.39343,1.39099,1.39115,2021-02-16 12:00:00+00:00
16.02.2021 13:00:00.000,1.39113,1.39136,1.388,1.38848,2021-02-16 13:00:00+00:00
16.02.2021 14:00:00.000,1.38848,1.38926,1.3869,1.3869,2021-02-16 14:00:00+00:00
16.02.2021 15:00:00.000,1.3869,1.39306,1.3869,1.39269,2021-02-16 15:00:00+00:00
16.02.2021 16:00:00.000,1.39268,1.39341,1.3904,1.39084,2021-02-16 16:00:00+00:00
16.02.2021 17:00:00.000,1.39084,1.39138,1.38997,1.39133,2021-02-16 17:00:00+00:00
16.02.2021 18:00:00.000,1.39133,1.39205,1.39091,1.39143,2021-02-16 18:00:00+00:00
16.02.2021 19:00:00.000,1.39142,1.39151,1.39087,1.39107,2021-02-16 19:00:00+00:00
16.02.2021 20:00:00.000,1.39109,1.39139,1.39064,1.39076,2021-02-16 20:00:00+00:00
16.02.2021 21:00:00.000,1.39075,1.39109,1.39004,1.39021,2021-02-16 21:00:00+00:00
16.02.2021 22:00:00.000,1.39014,1.39077,1.38979,1.3901,2021-02-16 22:00:00+00:00
16.02.2021 23:00:00.000,1.39012,1.39061,1.3885,1.3885,2021-02-16 23:00:00+00:00
17.02.2021 00:00:00.000,1.3885,1.38861,1.38652,1.38675,2021-02-17 00:00:00+00:00
17.02.2021 01:00:00.000,1.38675,1.38787,1.38616,1.38744,2021-02-17 01:00:00+00:00
17.02.2021 02:00:00.000,1.38746,1.38911,1.38729,1.3886,2021-02-17 02:00:00+00:00
17.02.2021 03:00:00.000,1.38863,1.3891,1.3877,1.38853,2021-02-17 03:00:00+00:00
17.02.2021 04:00:00.000,1.38853,1.3895,1.38831,1.38917,2021-02-17 04:00:00+00:00
17.02.2021 05:00:00.000,1.38916,1.38983,1.38893,1.38909,2021-02-17 05:00:00+00:00
17.02.2021 06:00:00.000,1.38908,1.38924,1.38777,1.38823,2021-02-17 06:00:00+00:00
17.02.2021 07:00:00.000,1.38824,1.38859,1.387,1.38792,2021-02-17 07:00:00+00:00
17.02.2021 08:00:00.000,1.38792,1.39037,1.38713,1.38908,2021-02-17 08:00:00+00:00
17.02.2021 09:00:00.000,1.38907,1.39023,1.38728,1.38842,2021-02-17 09:00:00+00:00
17.02.2021 10:00:00.000,1.3884,1.3884,1.38618,1.38685,2021-02-17 10:00:00+00:00
17.02.2021 11:00:00.000,1.38685,1.38706,1.3855,1.38613,2021-02-17 11:00:00+00:00
17.02.2021 12:00:00.000,1.38613,1.38796,1.38562,1.38727,2021-02-17 12:00:00+00:00
17.02.2021 13:00:00.000,1.38725,1.38862,1.38444,1.38476,2021-02-17 13:00:00+00:00
17.02.2021 14:00:00.000,1.38477,1.38597,1.38411,1.3854,2021-02-17 14:00:00+00:00
17.02.2021 15:00:00.000,1.3854,1.38636,1.38358,1.38511,2021-02-17 15:00:00+00:00
17.02.2021 16:00:00.000,1.38512,1.38566,1.38294,1.38456,2021-02-17 16:00:00+00:00
17.02.2021 17:00:00.000,1.38457,1.38583,1.38441,1.38558,2021-02-17 17:00:00+00:00
17.02.2021 18:00:00.000,1.38558,1.38603,1.3852,1.3858,2021-02-17 18:00:00+00:00
17.02.2021 19:00:00.000,1.38581,1.38643,1.38549,1.38602,2021-02-17 19:00:00+00:00
17.02.2021 20:00:00.000,1.38602,1.38651,1.38588,1.38632,2021-02-17 20:00:00+00:00
17.02.2021 21:00:00.000,1.3863,1.38659,1.38588,1.3859,2021-02-17 21:00:00+00:00
17.02.2021 22:00:00.000,1.38626,1.38626,1.3853,1.38614,2021-02-17 22:00:00+00:00
17.02.2021 23:00:00.000,1.38614,1.38658,1.38587,1.38658,2021-02-17 23:00:00+00:00
18.02.2021 00:00:00.000,1.38657,1.3877,1.38649,1.38703,2021-02-18 00:00:00+00:00
18.02.2021 01:00:00.000,1.38705,1.38733,1.38572,1.38632,2021-02-18 01:00:00+00:00
18.02.2021 02:00:00.000,1.38631,1.38632,1.38507,1.38631,2021-02-18 02:00:00+00:00
18.02.2021 03:00:00.000,1.38631,1.38651,1.38466,1.38495,2021-02-18 03:00:00+00:00
18.02.2021 04:00:00.000,1.38495,1.3854,1.3847,1.38484,2021-02-18 04:00:00+00:00
18.02.2021 05:00:00.000,1.38485,1.38564,1.38477,1.38525,2021-02-18 05:00:00+00:00
18.02.2021 06:00:00.000,1.38526,1.38534,1.38423,1.38512,2021-02-18 06:00:00+00:00
18.02.2021 07:00:00.000,1.38511,1.3868,1.38395,1.38638,2021-02-18 07:00:00+00:00
18.02.2021 08:00:00.000,1.38639,1.39133,1.38615,1.39118,2021-02-18 08:00:00+00:00
18.02.2021 09:00:00.000,1.39118,1.39273,1.39047,1.39248,2021-02-18 09:00:00+00:00
18.02.2021 10:00:00.000,1.39245,1.39314,1.39214,1.39264,2021-02-18 10:00:00+00:00
18.02.2021 11:00:00.000,1.39261,1.39491,1.39219,1.3942,2021-02-18 11:00:00+00:00
18.02.2021 12:00:00.000,1.3942,1.39697,1.39292,1.39525,2021-02-18 12:00:00+00:00
18.02.2021 13:00:00.000,1.39527,1.39859,1.39484,1.39771,2021-02-18 13:00:00+00:00
18.02.2021 14:00:00.000,1.39771,1.39796,1.39482,1.39564,2021-02-18 14:00:00+00:00
18.02.2021 15:00:00.000,1.39564,1.39594,1.39264,1.3945,2021-02-18 15:00:00+00:00
18.02.2021 16:00:00.000,1.39449,1.39577,1.39434,1.39561,2021-02-18 16:00:00+00:00
18.02.2021 17:00:00.000,1.39559,1.39643,1.39471,1.39631,2021-02-18 17:00:00+00:00
18.02.2021 18:00:00.000,1.39641,1.39719,1.39612,1.39632,2021-02-18 18:00:00+00:00
18.02.2021 19:00:00.000,1.39632,1.39759,1.39631,1.39749,2021-02-18 19:00:00+00:00
18.02.2021 20:00:00.000,1.39747,1.39803,1.39725,1.39747,2021-02-18 20:00:00+00:00
18.02.2021 21:00:00.000,1.3975,1.39764,1.397,1.39725,2021-02-18 21:00:00+00:00
18.02.2021 22:00:00.000,1.39718,1.39746,1.3963,1.39709,2021-02-18 22:00:00+00:00
18.02.2021 23:00:00.000,1.39706,1.39751,1.39651,1.3967,2021-02-18 23:00:00+00:00
19.02.2021 00:00:00.000,1.3967,1.39753,1.39641,1.39747,2021-02-19 00:00:00+00:00
19.02.2021 01:00:00.000,1.39746,1.39751,1.39601,1.39621,2021-02-19 01:00:00+00:00
19.02.2021 02:00:00.000,1.39622,1.39622,1.3952,1.39567,2021-02-19 02:00:00+00:00
19.02.2021 03:00:00.000,1.39564,1.39575,1.39511,1.39522,2021-02-19 03:00:00+00:00
19.02.2021 04:00:00.000,1.39523,1.39653,1.39522,1.39644,2021-02-19 04:00:00+00:00
19.02.2021 05:00:00.000,1.39642,1.39752,1.39599,1.39719,2021-02-19 05:00:00+00:00
19.02.2021 06:00:00.000,1.39718,1.39834,1.39699,1.39747,2021-02-19 06:00:00+00:00
19.02.2021 07:00:00.000,1.39745,1.39853,1.39669,1.39822,2021-02-19 07:00:00+00:00
19.02.2021 08:00:00.000,1.39824,1.40052,1.3972,1.39982,2021-02-19 08:00:00+00:00
19.02.2021 09:00:00.000,1.39981,1.40079,1.39837,1.39893,2021-02-19 09:00:00+00:00
19.02.2021 10:00:00.000,1.39895,1.40048,1.39805,1.40031,2021-02-19 10:00:00+00:00
19.02.2021 11:00:00.000,1.4003,1.40033,1.39883,1.39953,2021-02-19 11:00:00+00:00
19.02.2021 12:00:00.000,1.39954,1.4018,1.39895,1.40161,2021-02-19 12:00:00+00:00
19.02.2021 13:00:00.000,1.4016,1.40359,1.40098,1.40298,2021-02-19 13:00:00+00:00
19.02.2021 14:00:00.000,1.40297,1.403,1.40096,1.40196,2021-02-19 14:00:00+00:00
19.02.2021 15:00:00.000,1.40196,1.40272,1.40098,1.40147,2021-02-19 15:00:00+00:00
19.02.2021 16:00:00.000,1.4015,1.40268,1.40074,1.40235,2021-02-19 16:00:00+00:00
19.02.2021 17:00:00.000,1.40236,1.4026,1.40078,1.40232,2021-02-19 17:00:00+00:00
19.02.2021 18:00:00.000,1.40231,1.40231,1.40058,1.40143,2021-02-19 18:00:00+00:00
19.02.2021 19:00:00.000,1.40141,1.40146,1.40063,1.40131,2021-02-19 19:00:00+00:00
19.02.2021 20:00:00.000,1.40131,1.40144,1.4001,1.40054,2021-02-19 20:00:00+00:00
19.02.2021 21:00:00.000,1.40055,1.40087,1.40005,1.40059,2021-02-19 21:00:00+00:00
19.02.2021 22:00:00.000,1.40059,1.40059,1.40059,1.40059,2021-02-19 22:00:00+00:00
19.02.2021 23:00:00.000,1.40059,1.40059,1.40059,1.40059,2021-02-19 23:00:00+00:00
20.02.2021 00:00:00.000,1.40059,1.40059,1.40059,1.40059,2021-02-20 00:00:00+00:00
20.02.2021 01:00:00.000,1.40059,1.40059,1.40059,1.40059,2021-02-20 01:00:00+00:00
20.02.2021 02:00:00.000,1.40059,1.40059,1.40059,1.40059,2021-02-20 02:00:00+00:00
20.02.2021 03:00:00.000,1.40059,1.40059,1.40059,1.40059,2021-02-20 03:00:00+00:00
20.02.2021 04:00:00.000,1.40059,1.40059,1.40059,1.40059,2021-02-20 04:00:00+00:00
20.02.2021 05:00:00.000,1.40059,1.40059,1.40059,1.40059,2021-02-20 05:00:00+00:00
20.02.2021 06:00:00.000,1.40059,1.40059,1.40059,1.40059,2021-02-20 06:00:00+00:00
20.02.2021 07:00:00.000,1.40059,1.40059,1.40059,1.40059,2021-02-20 07:00:00+00:00
20.02.2021 08:00:00.000,1.40059,1.40059,1.40059,1.40059,2021-02-20 08:00:00+00:00
20.02.2021 09:00:00.000,1.40059,1.40059,1.40059,1.40059,2021-02-20 09:00:00+00:00
20.02.2021 10:00:00.000,1.40059,1.40059,1.40059,1.40059,2021-02-20 10:00:00+00:00
20.02.2021 11:00:00.000,1.40059,1.40059,1.40059,1.40059,2021-02-20 11:00:00+00:00
20.02.2021 12:00:00.000,1.40059,1.40059,1.40059,1.40059,2021-02-20 12:00:00+00:00
20.02.2021 13:00:00.000,1.40059,1.40059,1.40059,1.40059,2021-02-20 13:00:00+00:00
20.02.2021 14:00:00.000,1.40059,1.40059,1.40059,1.40059,2021-02-20 14:00:00+00:00
20.02.2021 15:00:00.000,1.40059,1.40059,1.40059,1.40059,2021-02-20 15:00:00+00:00
20.02.2021 16:00:00.000,1.40059,1.40059,1.40059,1.40059,2021-02-20 16:00:00+00:00
20.02.2021 17:00:00.000,1.40059,1.40059,1.40059,1.40059,2021-02-20 17:00:00+00:00
20.02.2021 18:00:00.000,1.40059,1.40059,1.40059,1.40059,2021-02-20 18:00:00+00:00
20.02.2021 19:00:00.000,1.40059,1.40059,1.40059,1.40059,2021-02-20 19:00:00+00:00
20.02.2021 20:00:00.000,1.40059,1.40059,1.40059,1.40059,2021-02-20 20:00:00+00:00
20.02.2021 21:00:00.000,1.40059,1.40059,1.40059,1.40059,2021-02-20 21:00:00+00:00
20.02.2021 22:00:00.000,1.40059,1.40059,1.40059,1.40059,2021-02-20 22:00:00+00:00
20.02.2021 23:00:00.000,1.40059,1.40059,1.40059,1.40059,2021-02-20 23:00:00+00:00
21.02.2021 00:00:00.000,1.40059,1.40059,1.40059,1.40059,2021-02-21 00:00:00+00:00
21.02.2021 01:00:00.000,1.40059,1.40059,1.40059,1.40059,2021-02-21 01:00:00+00:00
21.02.2021 02:00:00.000,1.40059,1.40059,1.40059,1.40059,2021-02-21 02:00:00+00:00
21.02.2021 03:00:00.000,1.40059,1.40059,1.40059,1.40059,2021-02-21 03:00:00+00:00
21.02.2021 04:00:00.000,1.40059,1.40059,1.40059,1.40059,2021-02-21 04:00:00+00:00
21.02.2021 05:00:00.000,1.40059,1.40059,1.40059,1.40059,2021-02-21 05:00:00+00:00
21.02.2021 06:00:00.000,1.40059,1.40059,1.40059,1.40059,2021-02-21 06:00:00+00:00
21.02.2021 07:00:00.000,1.40059,1.40059,1.40059,1.40059,2021-02-21 07:00:00+00:00
21.02.2021 08:00:00.000,1.40059,1.40059,1.40059,1.40059,2021-02-21 08:00:00+00:00
21.02.2021 09:00:00.000,1.40059,1.40059,1.40059,1.40059,2021-02-21 09:00:00+00:00
21.02.2021 10:00:00.000,1.40059,1.40059,1.40059,1.40059,2021-02-21 10:00:00+00:00
21.02.2021 11:00:00.000,1.40059,1.40059,1.40059,1.40059,2021-02-21 11:00:00+00:00
21.02.2021 12:00:00.000,1.40059,1.40059,1.40059,1.40059,2021-02-21 12:00:00+00:00
21.02.2021 13:00:00.000,1.40059,1.40059,1.40059,1.40059,2021-02-21 13:00:00+00:00
21.02.2021 14:00:00.000,1.40059,1.40059,1.40059,1.40059,2021-02-21 14:00:00+00:00
21.02.2021 15:00:00.000,1.40059,1.40059,1.40059,1.40059,2021-02-21 15:00:00+00:00
21.02.2021 16:00:00.000,1.40059,1.40059,1.40059,1.40059,2021-02-21 16:00:00+00:00
21.02.2021 17:00:00.000,1.40059,1.40059,1.40059,1.40059,2021-02-21 17:00:00+00:00
21.02.2021 18:00:00.000,1.40059,1.40059,1.40059,1.40059,2021-02-21 18:00:00+00:00
21.02.2021 19:00:00.000,1.40059,1.40059,1.40059,1.40059,2021-02-21 19:00:00+00:00
21.02.2021 20:00:00.000,1.40059,1.40059,1.40059,1.40059,2021-02-21 20:00:00+00:00
21.02.2021 21:00:00.000,1.40059,1.40059,1.40059,1.40059,2021-02-21 21:00:00+00:00
21.02.2021 22:00:00.000,1.4011,1.40188,1.40102,1.40136,2021-02-21 22:00:00+00:00
21.02.2021 23:00:00.000,1.40132,1.40312,1.40058,1.40272,2021-02-21 23:00:00+00:00
22.02.2021 00:00:00.000,1.40273,1.40431,1.40208,1.40321,2021-02-22 00:00:00+00:00
22.02.2021 01:00:00.000,1.4032,1.40522,1.40314,1.40334,2021-02-22 01:00:00+00:00
22.02.2021 02:00:00.000,1.40333,1.40337,1.40113,1.40175,2021-02-22 02:00:00+00:00
22.02.2021 03:00:00.000,1.40176,1.40224,1.4014,1.40179,2021-02-22 03:00:00+00:00
22.02.2021 04:00:00.000,1.40181,1.40265,1.40181,1.40213,2021-02-22 04:00:00+00:00
22.02.2021 05:00:00.000,1.40214,1.40237,1.40137,1.40168,2021-02-22 05:00:00+00:00
22.02.2021 06:00:00.000,1.40169,1.40185,1.40105,1.40133,2021-02-22 06:00:00+00:00
22.02.2021 07:00:00.000,1.40131,1.40142,1.39803,1.39916,2021-02-22 07:00:00+00:00
22.02.2021 08:00:00.000,1.39914,1.40065,1.39854,1.40003,2021-02-22 08:00:00+00:00
22.02.2021 09:00:00.000,1.40002,1.40255,1.39966,1.40134,2021-02-22 09:00:00+00:00
22.02.2021 10:00:00.000,1.40135,1.40284,1.40133,1.40241,2021-02-22 10:00:00+00:00
22.02.2021 11:00:00.000,1.40242,1.40436,1.4021,1.40233,2021-02-22 11:00:00+00:00
22.02.2021 12:00:00.000,1.40233,1.40366,1.4015,1.40284,2021-02-22 12:00:00+00:00
22.02.2021 13:00:00.000,1.40284,1.40462,1.40172,1.40462,2021-02-22 13:00:00+00:00
22.02.2021 14:00:00.000,1.40461,1.4047,1.40232,1.4047,2021-02-22 14:00:00+00:00
22.02.2021 15:00:00.000,1.4047,1.40687,1.40426,1.40522,2021-02-22 15:00:00+00:00
22.02.2021 16:00:00.000,1.40521,1.40766,1.40447,1.40751,2021-02-22 16:00:00+00:00
22.02.2021 17:00:00.000,1.40751,1.40861,1.40705,1.40821,2021-02-22 17:00:00+00:00
22.02.2021 18:00:00.000,1.4082,1.40854,1.40772,1.4079,2021-02-22 18:00:00+00:00
22.02.2021 19:00:00.000,1.40789,1.40836,1.40752,1.4076,2021-02-22 19:00:00+00:00
22.02.2021 20:00:00.000,1.4076,1.4076,1.40592,1.40605,2021-02-22 20:00:00+00:00
22.02.2021 21:00:00.000,1.40606,1.40645,1.40575,1.40608,2021-02-22 21:00:00+00:00
22.02.2021 22:00:00.000,1.40608,1.40747,1.40577,1.40687,2021-02-22 22:00:00+00:00
22.02.2021 23:00:00.000,1.40687,1.40749,1.40633,1.40673,2021-02-22 23:00:00+00:00
23.02.2021 00:00:00.000,1.40673,1.40762,1.40624,1.40735,2021-02-23 00:00:00+00:00
